2016-07-14,2016-07-15,False,He job economic authority.
2013-11-05,2013-11-07,True,Without above central.
2012-02-23,2012-02-26,False,Identify life house rest federal.
2012-12-15,2012-12-20,False,Live discuss dog so road approach send.
2014-10-19,2014-10-20,True,Simply all after simply fast clearly southern.
2017-01-07,2017-01-12,True,Unit film technology section.
2010-01-16,2010-01-20,False,White knowledge five president either.
2013-10-13,2013-10-14,True,Father per present explain everyone.
2012-01-19,2012-01-24,False,Force society pull difference hair trouble.
2013-09-18,2013-09-22,True,Decision already people house moment morning room.
2017-08-25,2017-08-28,False,Claim road society black.
2017-10-04,2017-10-06,False,Friend federal could together some because under.
2017-08-04,2017-08-09,False,Black benefit agent Congress change degree blood.
2010-04-25,2010-04-28,True,Base type learn late need director.
2016-08-22,2016-08-24,True,Maintain send important involve stuff step.
2011-11-22,2011-11-25,False,Town goal front.
2017-10-05,2017-10-09,False,Rule training upon interest.
2012-06-16,2012-06-19,False,Ask sense reflect network.
2015-07-10,2015-07-14,False,Television across themselves available early Democrat.
2018-11-03,2018-11-06,False,Increase involve form growth.
2014-04-10,2014-04-15,True,All let mother own.
2011-10-17,2011-10-22,True,Project develop point plant write anyone night.
2017-09-14,2017-09-18,True,Reflect rise product husband great laugh activity.
2017-11-04,2017-11-05,False,Whose eat cultural central tax author.
2016-02-15,2016-02-17,True,It choose music tough stuff speech.
2015-07-27,2015-07-29,True,Condition treat president plant different.
2017-11-24,2017-11-29,False,Author shoulder whole this economic team real.
2012-06-03,2012-06-08,False,Rule American policy statement parent anything themselves.
2014-07-28,2014-08-02,True,Collection season good certainly.
2016-03-21,2016-03-26,False,Care senior rest experience piece.
2016-12-31,2017-01-01,True,Weight animal teach fly field good.
2014-08-02,2014-08-07,False,Relate child specific us.
2012-12-15,2012-12-18,False,Quite relationship station along.
2013-05-01,2013-05-02,True,Record state fact station represent eye.
2014-01-09,2014-01-14,False,Bed speech ever buy enter perform.
2014-05-21,2014-05-26,False,Five news challenge.
2011-02-09,2011-02-12,True,Strategy number place least small.
2018-09-05,2018-09-06,False,Again teach fast see before.
2011-06-10,2011-06-15,True,Could eye every high million.
2014-06-26,2014-06-27,True,Study alone everyone.
2011-11-19,2011-11-20,False,Meet few above wear finally.
2010-06-02,2010-06-05,True,Apply billion either hit fine cost.
2012-02-16,2012-02-18,False,Education success born some scientist prevent half.
2010-08-19,2010-08-20,True,Ask list yes little.
2015-08-28,2015-09-01,False,Meet artist order policy rule final political.
2014-02-14,2014-02-15,False,Take middle bad bar.
2018-02-13,2018-02-18,False,Leg information different soldier expert like official.
2018-01-03,2018-01-04,True,Author new alone only long.
2016-06-05,2016-06-10,False,Follow require painting phone any even fill.
2011-04-05,2011-04-06,False,Consider try where apply whole.
2018-04-06,2018-04-09,False,Writer message fly local plan quite support.
2018-03-07,2018-03-12,True,Rock car live traditional according government can arrive.
2018-10-29,2018-11-02,True,Improve sing throughout cover.
2010-10-21,2010-10-22,False,Detail defense whatever network responsibility yeah note.
2014-07-24,2014-07-28,False,Evening gun religious dark hot little defense.
2010-11-20,2010-11-21,True,Two herself operation threat.
2010-11-28,2010-12-03,False,Common baby hold cold program least.
2017-04-20,2017-04-21,False,Worry nice remember politics image ball nation.
2016-04-22,2016-04-23,True,Deal wind also computer history.
2014-07-10,2014-07-15,False,Western theory lose into.
2016-12-07,2016-12-11,True,Begin conference recent before.
2010-09-07,2010-09-08,True,View compare reason executive above.
2014-12-05,2014-12-09,False,Leader wear street.
2010-04-16,2010-04-17,True,West color spring own same.
2012-10-31,2012-11-03,False,There story one long foot him traditional.
2010-05-03,2010-05-08,False,Attack pick reveal thank.
2016-06-11,2016-06-15,False,Sit tree ground girl.
2011-09-16,2011-09-17,True,Fund simply throughout late population part.
2017-02-25,2017-02-28,False,Evening challenge glass lose.
2010-06-07,2010-06-12,False,Environment all ball better.
2011-09-23,2011-09-26,False,Leg so hold across walk tell because.
2017-06-01,2017-06-04,False,Either see which boy.
2016-06-30,2016-07-05,True,Tell really scene expert main our forget work.
2012-04-24,2012-04-29,True,Energy staff quickly story.
2017-05-28,2017-06-02,True,Education authority employee power position.
2017-08-24,2017-08-29,False,Once news practice trade seat film specific.
2014-02-03,2014-02-08,True,Let reveal production stay share.
2010-05-22,2010-05-25,True,Serious car federal more.
2015-12-07,2015-12-11,True,Raise film number nice condition teach write summer.
2013-03-21,2013-03-26,True,Many manage end always center.
2016-09-16,2016-09-18,True,Democratic rather truth boy on half require.
2016-05-02,2016-05-04,True,Sound wonder item family.
2011-05-15,2011-05-20,False,More one stuff about.
2015-12-01,2015-12-04,True,Food PM himself though inside understand.
2012-10-18,2012-10-23,True,Company appear subject language thing firm.
2013-04-03,2013-04-04,False,Particularly our do TV.
2018-08-18,2018-08-21,True,Marriage environmental walk develop lead particular.
2010-04-18,2010-04-23,False,These crime daughter.
2013-02-05,2013-02-10,False,West first happen.
2015-03-06,2015-03-11,False,Fine eight in growth add hope.
2014-07-17,2014-07-18,True,Star half study very society common they fund.
2012-12-29,2013-01-03,False,Far some south accept old friend which.
2011-09-05,2011-09-08,False,The might agreement culture most others whatever fall.
2017-04-27,2017-04-28,False,Pull professor visit suddenly some professor if.
2012-04-22,2012-04-26,True,Individual never run approach and fly.
2010-12-19,2010-12-23,False,Smile cold better benefit hour happen bring marriage.
2012-02-06,2012-02-09,False,Gas party character.
2016-05-10,2016-05-13,False,However option house.
2011-12-29,2011-12-30,False,Pick front among cell space head state.
2017-12-17,2017-12-19,False,Movement eat themselves almost.
2012-11-10,2012-11-14,True,Avoid myself force nor east word.
2017-06-26,2017-06-29,True,Much fly ago bed your.
2018-06-04,2018-06-09,False,Woman level worry almost house reach operation military.
2010-11-22,2010-11-23,True,Talk treat everybody past example watch PM.
2010-04-29,2010-05-02,False,Entire huge put design its somebody continue.
2011-06-30,2011-07-05,True,Space page industry institution with me ready.
2012-04-18,2012-04-23,False,American director memory begin.
2011-04-03,2011-04-08,True,Sea particular charge agree role culture.
2012-10-23,2012-10-24,True,Than expert test know.
2012-09-24,2012-09-29,False,Foot task member attorney.
2014-09-15,2014-09-20,True,Very generation serious something.
2015-11-12,2015-11-14,True,Sit week be on pick.
2018-02-12,2018-02-17,False,And take month save.
2013-09-23,2013-09-28,False,Manage cell never.
2016-02-05,2016-02-06,True,Than both ball.
2013-10-12,2013-10-15,False,Others me full.
2017-10-26,2017-10-29,False,Management sort behavior moment.
2011-06-09,2011-06-14,False,Create by space pull turn.
2014-11-09,2014-11-10,False,Deal trip house protect.
2015-06-05,2015-06-07,False,Customer rise create morning treatment.
2014-12-25,2014-12-26,True,White two important coach.
2016-08-19,2016-08-20,False,On material determine generation let city soldier live.
2018-04-19,2018-04-20,False,Wish carry professor lose late.
2018-08-24,2018-08-27,True,Sure crime range food scientist hotel article policy.
2012-03-03,2012-03-08,True,Black song recent.
2014-04-21,2014-04-22,True,Industry seek research charge economy under where contain.
2016-05-24,2016-05-29,True,Herself after happy same.
2017-11-25,2017-11-28,False,Economy yes image.
2011-06-27,2011-07-01,True,Pick dream product subject order right cup.
2011-03-25,2011-03-29,False,Seat special reveal administration likely.
2015-09-18,2015-09-22,False,Medical none letter wrong wall nor future raise.
2011-03-03,2011-03-08,False,Person contain television music record.
2010-06-13,2010-06-16,False,Serious we improve party.
2010-11-22,2010-11-26,False,Bag picture control force game give above.
2011-12-29,2011-12-30,False,Religious relationship hour customer.
2014-01-20,2014-01-23,False,Today night every wrong.
2011-01-03,2011-01-06,False,Country space control option leg money.
2012-11-23,2012-11-24,True,Parent economy record particular.
2014-09-23,2014-09-27,False,Sort interview about factor.
2017-01-27,2017-01-29,True,Win guess stuff imagine may.
2018-10-08,2018-10-11,False,Ball year no magazine better.
2015-07-28,2015-08-02,False,Least available same camera play.
2014-08-13,2014-08-16,False,Clear mean push economic his chair exist.
2016-03-20,2016-03-22,False,Return improve story official public believe bad.
2010-07-26,2010-07-31,False,Inside develop notice type water trip.
2015-07-21,2015-07-25,False,The often business soldier clear thus in.
2014-10-06,2014-10-11,False,Hand nice weight clear school organization.
2017-05-09,2017-05-13,False,Section student wear chair billion threat.
2017-09-01,2017-09-02,True,Can drive city push.
2012-12-24,2012-12-26,False,Want race push spend include eye.
2018-07-29,2018-08-03,True,Manager government court my series.
2016-11-02,2016-11-07,True,Sit avoid above feeling where represent.
2010-08-14,2010-08-19,True,Evidence recent option hard certain star soon.
2017-10-24,2017-10-27,True,Court fine production drop society likely.
2014-06-09,2014-06-11,True,Whole voice morning speak me allow.
2011-11-29,2011-11-30,False,Positive effect arm just.
2017-01-20,2017-01-25,True,Foreign turn stage we organization.
2013-12-15,2013-12-18,False,Fact network left establish generation inside.
2013-07-31,2013-08-02,True,Foot peace maintain ever woman station could.
2017-04-22,2017-04-24,True,Evening nice reflect rich cause.
2013-08-25,2013-08-27,True,Ok plant happen site.
2010-04-11,2010-04-15,True,Room picture whether ago far.
2010-10-14,2010-10-19,False,Do available exist test question work section.
2015-07-15,2015-07-18,True,Option fly tend foreign indicate then cost.
2017-11-08,2017-11-13,False,Society always view hotel voice color.
2011-12-06,2011-12-07,False,Against car well without manage movement.
2011-04-27,2011-04-28,True,Drop whether age meet buy option like similar.
2013-03-03,2013-03-06,False,Catch force likely continue theory church.
2017-06-06,2017-06-09,True,Car during my store.
2015-11-28,2015-12-01,True,Worker there believe popular city.
2010-04-29,2010-04-30,False,Strong store already reach.
2011-06-15,2011-06-17,False,Kitchen imagine short line interest road.
2012-12-31,2013-01-04,True,Seek daughter safe early art between.
2012-10-31,2012-11-02,True,Business husband industry standard song.
2013-07-11,2013-07-13,False,Anyone position debate along however two.
2012-04-09,2012-04-13,False,Artist factor as out control husband.
2010-05-05,2010-05-07,True,Dark father allow build from they reality.
2014-05-12,2014-05-16,False,War skill section point commercial drive when cut.
2012-07-20,2012-07-23,False,Program mean policy listen.
2016-06-02,2016-06-06,True,Key side set during each factor employee.
2018-09-17,2018-09-22,False,Kid believe smile more cold happen follow feeling.
2012-06-29,2012-07-04,True,Car accept sister language standard.
2017-08-11,2017-08-16,False,Yourself would agree live.
2013-05-22,2013-05-23,True,Act well than laugh east personal begin.
2011-04-09,2011-04-10,False,Month less parent history day occur before.
2017-08-15,2017-08-18,False,Sign design before service government security finally.
2012-03-15,2012-03-18,True,Miss large would military reflect page event.
2017-06-21,2017-06-22,False,Feeling per hand everything among international yet.
2010-06-16,2010-06-20,False,Social change family past talk.
2015-04-15,2015-04-19,True,Television break as but fish several live.
2013-07-31,2013-08-01,True,Statement fall course face among natural hotel.
2018-10-12,2018-10-15,False,College job sport.
2015-04-29,2015-05-03,False,Party people series send.
2014-06-11,2014-06-13,True,Wish hand camera to.
2017-05-31,2017-06-03,True,Full likely son life large.
2015-07-29,2015-08-01,False,Hospital necessary heavy seek determine.
2013-05-02,2013-05-03,True,Staff class writer simply international story.
2010-12-01,2010-12-03,True,Huge wife speak three.
2016-12-22,2016-12-25,False,Benefit dream another particular again.
2015-06-05,2015-06-09,False,Policy lot field have team thank price Mrs.
2010-12-23,2010-12-28,False,Find peace save beyond skin dog if.
2014-03-04,2014-03-07,True,Specific thank TV American though employee least.
2011-10-02,2011-10-07,True,American become film size job bar.
2011-03-09,2011-03-13,False,American natural hold top summer realize.
2010-04-21,2010-04-25,True,State strategy relate listen court.
2018-02-27,2018-03-04,False,However policy left course area cut region.
2018-06-05,2018-06-10,False,Kind line court system statement enjoy program up.
2011-10-21,2011-10-23,False,Increase fly skin effect sort.
2015-02-02,2015-02-06,True,Society one choose image.
2010-06-27,2010-07-02,True,Tv cost memory whose find share ask.
2011-04-27,2011-04-30,False,Left sometimes community responsibility rule why.
2014-02-03,2014-02-08,True,Huge near off positive its difficult.
2013-11-02,2013-11-03,True,Own reduce movement.
2017-03-29,2017-04-03,True,Water share health carry yes teacher.
2014-11-12,2014-11-13,False,Rate glass move because but modern sound.
2018-05-20,2018-05-21,False,Arm hair whole to hear candidate.
2017-03-15,2017-03-17,True,Newspaper security case news white sound image.
2011-01-01,2011-01-05,False,Relationship play young daughter.
2014-06-18,2014-06-21,False,Above model himself street wind consumer.
2013-06-05,2013-06-08,True,Sound station cell guy resource.
2017-02-09,2017-02-14,True,Capital with authority environment weight statement.
2015-09-24,2015-09-26,True,Congress despite build well service expert start enjoy.
2015-02-07,2015-02-11,False,Water teacher be final put concern.
2011-02-09,2011-02-12,True,Six box tend population forward security several.
2017-06-28,2017-06-29,True,Ever sound of which.
2011-02-15,2011-02-16,False,Commercial still kitchen in describe security arrive oil.
2017-10-07,2017-10-09,False,Describe boy want try sound technology coach.
2012-10-13,2012-10-15,True,Within red each on foot.
2011-11-22,2011-11-24,True,Sure police office west.
2016-11-09,2016-11-11,False,Region possible company government piece thousand health.
2012-06-09,2012-06-11,True,Provide glass might station start.
2018-05-25,2018-05-27,False,Model voice instead young popular growth result.
2014-11-30,2014-12-05,True,Anyone leg return community.
2015-05-10,2015-05-13,True,Guess raise career owner again purpose ball.
2018-06-21,2018-06-23,False,Themselves finally certain.
2013-09-12,2013-09-15,False,Do reflect scene quickly past unit.
2014-12-27,2014-12-29,False,We least at marriage card.
2011-09-10,2011-09-14,False,National guess early quite once perhaps.
2016-12-17,2016-12-20,True,Suffer laugh society movie not return indeed.
2016-05-24,2016-05-29,False,Nor character gun single score charge.
2017-10-09,2017-10-11,True,Card agree decision lawyer hear cell board.
2016-05-15,2016-05-18,True,Foreign over answer course agree.
2012-12-19,2012-12-21,True,Structure hope court happen trip PM college.
2017-05-13,2017-05-14,True,May song room natural gun everything else which.
2011-07-05,2011-07-07,True,Hotel across bit support maybe.
2015-08-03,2015-08-05,False,Of almost make military response.
2013-12-11,2013-12-16,False,Space street you moment candidate matter.
2011-07-14,2011-07-16,True,Participant school too data rest near election.
2013-06-29,2013-07-04,False,Deal yeah window me red.
2012-05-03,2012-05-06,False,Any anything no.
2015-10-12,2015-10-15,True,Imagine rest school control.
2013-03-20,2013-03-25,False,True drug share the soon.
2011-11-14,2011-11-15,True,International pick event page certain certain certainly rather.
2010-07-25,2010-07-29,False,Amount worker company organization child cover.
2011-09-16,2011-09-18,True,Loss pick Republican several.
2013-07-01,2013-07-06,True,Party away forget road director special.
2012-07-08,2012-07-12,True,Area Republican partner.
2018-03-23,2018-03-26,True,Word ready TV whole write.
2016-04-11,2016-04-12,True,Change performance condition find information among perhaps professional.
2015-04-12,2015-04-14,False,Gun after budget still.
2013-05-03,2013-05-08,True,Week vote guess I meeting type test.
2014-02-22,2014-02-27,True,Would way during build bad.
2018-06-23,2018-06-28,False,Whom least door relationship trade direction.
2015-11-21,2015-11-23,True,No value garden machine behind standard adult.
2010-09-28,2010-10-01,False,Them couple company control level full clearly.
2014-09-15,2014-09-16,True,Shoulder team short market perhaps maybe.
2014-08-12,2014-08-15,True,Film health but moment stage fear.
2018-03-15,2018-03-17,True,Already federal single everything son future.
2013-09-27,2013-09-29,False,Itself prevent knowledge.
2012-11-10,2012-11-11,True,Region hold herself fire open which or surface.
2010-12-16,2010-12-20,True,Quality international gas contain heavy power.
2016-06-09,2016-06-11,False,Life take college.
2017-12-09,2017-12-13,False,Require lay sure between.
2016-10-24,2016-10-26,True,Professor ready although then.
2018-11-03,2018-11-04,True,Compare early board range carry establish admit.
2013-10-01,2013-10-06,True,Boy pattern point.
2015-03-25,2015-03-27,False,Which heart fact manager trouble.
2018-08-15,2018-08-20,True,Cause suggest notice we view short wrong evening.
2012-01-06,2012-01-09,False,Media around care it partner trade religious language.
2016-01-06,2016-01-11,True,Before left beyond skill role.
2013-02-02,2013-02-05,False,Prepare project threat.
2015-09-29,2015-10-01,True,This staff husband also think buy network poor.
2012-05-13,2012-05-16,True,Force production offer.
2018-01-01,2018-01-06,True,Sing lead medical land.
2018-08-11,2018-08-13,True,Yes standard project.
2015-12-24,2015-12-26,False,Reveal everybody decade wife.
2018-09-11,2018-09-15,False,Campaign game medical station site.
2010-07-19,2010-07-20,True,Especially and lot.
2014-09-13,2014-09-16,True,Theory serious course develop check.
2015-04-23,2015-04-26,True,Huge involve parent her mission authority.
2013-05-13,2013-05-18,False,Find strategy seat school fast.
2010-10-04,2010-10-08,True,Me pattern growth.
2010-08-07,2010-08-08,True,Growth without painting number.
2015-12-22,2015-12-26,False,See thus law us deep imagine.
2012-01-14,2012-01-16,False,Require give like.
2016-05-31,2016-06-02,False,Provide sort rest training resource prove too.
2015-03-05,2015-03-06,False,Project everything camera sort see spring treat.
2015-11-01,2015-11-06,True,Author board certainly.
2017-12-03,2017-12-05,False,Produce rich cut traditional opportunity although other.
2017-07-30,2017-08-04,False,Even appear against certain get technology.
2011-07-17,2011-07-18,False,Power state world attention.
2011-02-06,2011-02-09,True,Benefit nor tree education know evidence word.
2011-05-04,2011-05-05,False,Bag start true nice bank.
2013-07-11,2013-07-15,False,Strong radio will small rather without among.
2016-06-23,2016-06-25,False,Rise picture word boy.
2011-01-23,2011-01-27,True,Usually outside financial bill sense decade religious describe.
2016-11-11,2016-11-12,False,Camera cut none party later her.
2013-08-14,2013-08-17,True,Product both along suggest must candidate.
2010-12-13,2010-12-18,False,Out central leave heart off.
2017-11-30,2017-12-03,True,Store pretty investment eat task election.
2012-04-25,2012-04-30,True,Tough friend fish cut all build.
2016-06-12,2016-06-16,True,National several design cut.
2016-06-18,2016-06-20,True,Party doctor wait speak answer cost indeed.
2016-04-11,2016-04-16,True,General democratic can tend itself.
2011-02-24,2011-02-26,True,Now tree he drive in.
2012-05-05,2012-05-06,False,Forward shoulder necessary various.
2012-03-24,2012-03-25,False,Face task girl lot.
2011-09-14,2011-09-16,False,Toward order where statement.
2017-02-15,2017-02-17,False,Already although floor these lead bad concern.
2010-03-08,2010-03-10,False,Organization education trade share drug hot glass.
2010-10-09,2010-10-12,False,Risk scientist style audience impact station.
2013-02-06,2013-02-09,False,Police discuss poor.
2014-08-11,2014-08-12,True,Board age protect treatment music hospital together.
2016-07-25,2016-07-28,False,Receive chair safe nearly.
2010-02-08,2010-02-12,False,Learn everybody east song order or data social.
2011-06-01,2011-06-03,True,Idea note church will.
2014-08-13,2014-08-18,True,Base both start.
2014-06-08,2014-06-10,True,Friend article health most.
2018-05-06,2018-05-09,False,Across perhaps forward represent new.
2010-09-16,2010-09-19,False,Professional charge help individual see open.
2014-08-23,2014-08-28,True,Your challenge sit here.
2016-08-21,2016-08-26,False,Each resource series camera likely store.
2011-10-04,2011-10-07,True,Guess prevent magazine chair dark effort.
2017-06-29,2017-07-02,False,Somebody five on will main certain.
2016-01-28,2016-01-29,True,Thousand need film front bill hair want particularly.
2013-03-20,2013-03-24,True,Pm treatment use list really.
2011-12-04,2011-12-05,True,Serious indeed ground behavior event.
2016-03-20,2016-03-24,True,News whose foreign painting stuff pretty only.
2012-01-01,2012-01-02,True,During training break.
2014-07-11,2014-07-16,True,Dog open the away maybe.
2012-08-29,2012-09-03,True,Fill situation day good old different.
2013-02-26,2013-03-02,False,Policy pretty attorney.
2016-05-20,2016-05-22,False,Picture prevent risk theory at matter.
2017-06-19,2017-06-20,True,Loss hit agency tell.
2010-06-06,2010-06-09,False,Population just form consider.
2016-01-26,2016-01-27,False,Security girl pay difficult school total.
2015-04-19,2015-04-22,True,Radio ever his difference.
2011-07-20,2011-07-22,False,Mission design imagine first any we.
2010-11-02,2010-11-03,True,Front development local high most professional.
2010-10-30,2010-11-03,False,Upon avoid poor sort.
2013-01-22,2013-01-24,True,Congress today pass seek spend.
2013-05-21,2013-05-26,False,Whose green treatment within surface.
2015-08-04,2015-08-06,False,Song financial poor occur world trip sometimes.
2017-05-03,2017-05-04,False,Dinner bank it though although sort.
2015-03-05,2015-03-10,True,How hair raise radio political interview coach.
2016-02-05,2016-02-09,True,Guy able especially.
2013-05-25,2013-05-26,True,Rock successful land heart.
2017-08-04,2017-08-07,True,Term tax shake make.
2011-02-12,2011-02-14,False,Congress tough group them kid own however.
2012-04-24,2012-04-28,True,Explain question still get subject imagine.
2013-12-30,2013-12-31,True,Perform each some any.
2016-05-07,2016-05-09,True,Campaign or fact forget around just discussion.
2016-08-07,2016-08-11,False,Affect cause story black inside major really.
2016-11-08,2016-11-12,False,Something ground begin onto throughout.
2018-06-13,2018-06-18,True,Season know sure wish college government.
2016-09-12,2016-09-16,True,Eight close while up order ask true.
2018-01-26,2018-01-28,True,Interesting herself practice now job marriage.
2010-06-13,2010-06-14,False,And beautiful suggest spend pay up could.
2015-12-08,2015-12-09,False,Task live claim up.
2011-12-10,2011-12-11,True,Sense able fund rest feel.
2011-07-20,2011-07-24,True,Note collection girl them.
2016-11-14,2016-11-15,True,Everything return music.
2010-09-14,2010-09-16,False,Action hear teacher stay indeed.
2016-03-19,2016-03-20,True,Lay ball apply.
2012-06-20,2012-06-21,False,Federal see system.
2017-10-10,2017-10-13,False,Show or let information last PM middle.
2013-12-03,2013-12-07,True,Meet sister ready may few thus.
2015-03-22,2015-03-26,True,Five former talk reality husband finally.
2016-07-23,2016-07-28,True,Relate tough bill point.
2011-01-28,2011-01-30,False,Science total worker born suggest thank example.
2010-10-08,2010-10-10,False,Company cold color black born entire.
2016-09-03,2016-09-06,True,Bed treat southern.
2012-12-17,2012-12-22,True,Make election hair represent.
2014-02-14,2014-02-16,False,Water sometimes whose still again allow factor.
2018-02-14,2018-02-16,True,Hour word plant traditional.
2018-07-25,2018-07-26,True,Somebody effort government federal watch.
2016-03-29,2016-04-03,False,Professional form onto better off admit event.
2012-03-10,2012-03-14,False,Her fine be our.
2010-04-18,2010-04-19,False,Time air politics.
2011-08-24,2011-08-28,False,Nation despite yourself whose nation produce prove.
2015-11-27,2015-11-29,True,Discuss firm themselves away.
2016-01-06,2016-01-09,False,For ball rock other.
2010-07-13,2010-07-14,True,Future suggest forward sign above.
2013-06-28,2013-07-01,True,There real with nation north truth glass.
2013-07-05,2013-07-10,False,Crime wait soldier person woman throw particularly.
2015-09-12,2015-09-17,False,Clear behind current lead anyone than.
2012-06-10,2012-06-13,True,Class throw receive news other property last.
2013-05-04,2013-05-09,True,Reduce option discover me nature pick people.
2010-02-27,2010-03-01,False,Fire professional always actually shoulder late agent.
2013-06-15,2013-06-17,True,Establish for yes who final able.
2013-09-02,2013-09-06,False,Present threat several table every mother natural.
2014-01-16,2014-01-19,True,Leave civil benefit exactly give store.
2018-05-13,2018-05-15,False,Each full agency even.
2012-05-20,2012-05-21,False,Case participant teach record certain hit.
2012-07-17,2012-07-21,True,Knowledge gas bad wait particular stock.
