2011-09-13,2011-09-16,False,Fire necessary political another job.
2013-06-28,2013-07-01,True,Form keep blood born describe include law.
2010-01-26,2010-01-27,True,Staff sea region conference toward staff.
2017-05-10,2017-05-11,False,Form mean fill may face turn clearly.
2017-07-11,2017-07-12,False,Involve wear cup final fire challenge head.
2013-05-07,2013-05-08,False,Easy task space he keep majority.
2015-06-02,2015-06-04,True,Light part artist.
2010-11-05,2010-11-06,True,Focus though Mr avoid.
2013-05-23,2013-05-24,False,Any bit heavy civil five call her.
2010-08-14,2010-08-15,False,Child per treatment Democrat.
2015-05-18,2015-05-19,False,Situation produce doctor firm little way audience.
2012-11-20,2012-11-25,True,Among ever market baby offer try green must.
2011-09-11,2011-09-12,True,Hold region current focus tax plan senior.
2014-06-16,2014-06-20,False,Plan three sea daughter.
2012-05-07,2012-05-08,True,Enjoy candidate worry green big coach thus point.
2016-10-01,2016-10-04,False,Truth without real beautiful east opportunity.
2017-07-18,2017-07-21,False,Whose share edge foot suffer dinner training.
2016-01-30,2016-02-03,False,Activity authority thus.
2015-05-26,2015-05-28,True,Compare heavy prove chair.
2010-09-16,2010-09-19,False,Common me per occur night floor.
2011-07-06,2011-07-08,True,Yourself peace describe prepare land process.
2014-08-29,2014-09-01,True,Word hard trial east college site.
2018-01-11,2018-01-14,False,Practice view technology couple full industry center.
2012-03-24,2012-03-26,True,Price career only foreign matter step whose say.
2013-01-29,2013-02-03,True,Mission center group usually significant fear.
2012-06-18,2012-06-21,False,Address pressure short clearly.
2015-04-04,2015-04-08,True,Wonder television least animal floor local.
2016-04-22,2016-04-27,False,West agreement record.
2010-12-03,2010-12-07,False,Soldier recent blue step realize prove great mean.
2014-10-17,2014-10-18,False,In painting go decision three speech college.
2010-09-16,2010-09-19,True,Rock say week clearly.
2016-09-10,2016-09-11,False,Image every entire color movement accept use.
2017-08-20,2017-08-24,False,There authority he too area door green.
2017-01-01,2017-01-04,False,Manager Democrat late sea so single.
2014-01-29,2014-01-31,False,Doctor seat full card laugh cut.
2016-11-23,2016-11-28,True,At money blue perform himself use half.
2010-09-27,2010-10-01,False,Less focus however chance.
2011-05-07,2011-05-09,True,Your forget little voice Mr wind poor.
2011-03-10,2011-03-12,False,Investment thing Republican company year check foreign.
2017-07-04,2017-07-08,False,Type group person cup fine option better.
2017-06-23,2017-06-27,False,Staff level customer main.
2015-06-18,2015-06-19,False,Memory body interesting soldier parent water country.
2010-08-12,2010-08-14,True,Whose industry recently full.
2016-05-24,2016-05-25,False,Its activity protect quality development throughout floor.
2013-10-30,2013-11-03,True,Color garden stage charge out.
2018-05-08,2018-05-13,False,Once great compare ability court.
2013-05-30,2013-06-02,True,Guy wish something without.
2016-04-23,2016-04-28,True,Fly capital because energy.
2014-07-16,2014-07-21,True,Loss expect officer tough yeah.
2015-04-24,2015-04-29,False,Anything worker trade memory system level area lead.
2011-06-19,2011-06-23,False,Leg and some avoid.
2015-03-06,2015-03-09,False,Bank education improve it pay.
2014-06-05,2014-06-09,False,Art memory behavior while sell although property.
2017-07-21,2017-07-26,False,Face reason meet hope always.
2011-08-27,2011-09-01,False,Watch son leave president red whatever anything.
2013-02-27,2013-03-01,True,Join less company whose unit.
2012-04-13,2012-04-18,True,Grow any benefit than.
2016-03-06,2016-03-10,True,Machine industry still bed reach policy economic.
2018-09-01,2018-09-04,True,Hour staff respond manager up citizen specific.
2015-12-29,2016-01-01,True,Deal century start plant.
2017-04-28,2017-04-29,True,Most allow world include share.
2018-10-23,2018-10-25,True,Lot common hard medical difference arm listen.
2011-04-26,2011-04-28,False,Turn few charge student.
2014-11-20,2014-11-21,False,Court financial crime nature form election word.
2010-07-22,2010-07-24,False,Head project there tonight better office.
2016-06-26,2016-06-29,False,Usually dream fact sing style.
2010-01-01,2010-01-05,False,Industry up write serve concern.
2017-05-06,2017-05-09,False,Social key fill stop.
2011-07-12,2011-07-17,True,Hour public him charge kitchen action.
2014-08-02,2014-08-04,True,Baby white other because.
2015-09-03,2015-09-06,True,Traditional yet charge site raise.
2017-03-25,2017-03-28,True,Entire national year interest state.
2017-03-15,2017-03-19,False,Series into media main determine.
2014-12-15,2014-12-19,True,Western at book customer citizen carry could.
2016-07-27,2016-07-31,True,Travel consumer name despite claim physical keep.
2016-05-10,2016-05-15,False,Building what growth.
2010-03-12,2010-03-13,False,Just item social pressure morning ball.
2013-07-25,2013-07-28,False,Each hospital with effect.
2012-02-05,2012-02-10,True,Personal decade history certain great.
2018-01-24,2018-01-29,False,Myself sport bill college.
2015-06-22,2015-06-26,False,Business argue its claim court.
2012-05-30,2012-06-02,False,Piece exist red develop apply consider.
2012-06-27,2012-07-01,True,Fire security notice responsibility expert.
2016-02-02,2016-02-04,False,Generation ability phone standard visit total rule.
2017-07-23,2017-07-27,True,Stand might ok upon however alone still.
2012-08-27,2012-08-30,True,Know natural quite maybe include read wait.
2012-06-20,2012-06-22,True,Sign middle but myself.
2015-05-02,2015-05-04,False,Worry edge quality.
2016-11-16,2016-11-18,False,Think control move type plant high.
2013-08-06,2013-08-07,True,Must result reveal any.
2016-11-21,2016-11-26,True,Significant speak yard various drug security.
2011-06-03,2011-06-06,True,Heavy beat seem the finally manage around.
2017-03-11,2017-03-13,False,Better administration such how someone.
2014-08-26,2014-08-29,False,Important American life economy carry.
2015-10-11,2015-10-14,False,Movie even reason late right start.
2017-02-18,2017-02-19,True,Catch many big large.
2015-11-04,2015-11-05,False,Often ago manager fear than rich down.
2016-12-13,2016-12-15,False,Wait car likely girl able hit.
2012-11-26,2012-11-30,True,Low wait feeling coach guy news organization.
2016-07-16,2016-07-21,False,Own shake dinner enough change true base.
2011-01-29,2011-02-02,False,How drug too fish name about.
2017-07-12,2017-07-16,False,Pretty dinner war still indicate.
2011-05-24,2011-05-29,False,Factor policy sometimes.
2010-01-07,2010-01-12,False,Grow language their trade away.
2015-10-11,2015-10-12,True,Whose know hour close respond your.
2017-06-09,2017-06-12,True,Fact court reduce star including.
2018-02-19,2018-02-21,False,Candidate improve model citizen.
2011-12-14,2011-12-15,True,Season drug decision cold.
2011-11-10,2011-11-13,True,Consider ready community.
2011-01-01,2011-01-04,True,Than generation goal general act newspaper television.
2010-04-04,2010-04-05,False,Easy sort friend environmental leg.
2012-06-08,2012-06-10,False,Clear single at help material nation.
2016-01-03,2016-01-05,False,Night share Mr apply respond.
2018-09-19,2018-09-20,False,Southern couple whether development food air national.
2013-01-29,2013-02-03,True,Authority others edge thank player.
2015-11-18,2015-11-22,False,Which end professor owner drop notice.
2012-04-16,2012-04-21,True,Office environment able truth each year.
2012-07-14,2012-07-16,False,Area all foreign after win common camera effort.
2013-08-17,2013-08-22,False,Clearly know go suddenly relationship find.
2010-01-06,2010-01-09,False,Out Democrat collection something onto.
2016-06-20,2016-06-21,True,Car spend design style early unit.
2017-06-20,2017-06-21,True,Moment degree nation brother study market us table.
2010-04-09,2010-04-14,False,Hair beyond best total.
2011-10-22,2011-10-25,False,Election these always.
2017-06-01,2017-06-02,False,Generation bar unit lot important.
2011-05-01,2011-05-06,True,Box hotel wind institution more perform each.
2011-06-29,2011-07-04,True,Perform gun top fly audience southern small miss.
2013-09-04,2013-09-05,False,Play issue during through.
2011-01-04,2011-01-05,True,Voice argue again product there movement station feeling.
2016-01-11,2016-01-13,True,Then hospital challenge agent.
2015-07-12,2015-07-13,False,Again item get skin paper example century.
2014-11-10,2014-11-13,False,Money traditional suggest exist help thank reason.
2018-11-11,2018-11-13,True,Particularly building current southern several Mrs myself how.
2017-12-05,2017-12-08,False,Trouble affect cut knowledge whole wish.
2018-10-14,2018-10-15,False,White receive any risk size when.
2016-12-09,2016-12-14,False,Style early among inside.
2015-06-11,2015-06-12,False,Class outside tonight nice assume fast radio.
2013-09-30,2013-10-03,True,Ever lead bit speak role standard policy.
2014-09-10,2014-09-15,True,Second prevent any ready edge side.
2016-11-11,2016-11-16,False,Speech charge president.
2014-11-06,2014-11-11,False,Person identify hundred week responsibility.
2011-08-24,2011-08-27,True,Prevent political resource against.
2016-07-23,2016-07-25,False,Federal expert off threat hot worker.
2014-01-27,2014-01-30,False,Year American pressure join.
2017-09-12,2017-09-14,True,Father culture mouth among read learn.
2013-11-11,2013-11-14,True,Every wish movie stay remain.
2013-10-06,2013-10-08,False,No ask president.
2011-03-16,2011-03-17,True,Significant call glass by month same.
2014-11-23,2014-11-28,False,Suggest from her policy window new.
2015-07-31,2015-08-02,True,Manager civil author stage six spend moment.
2012-05-07,2012-05-11,True,Seven expert writer treatment another born establish.
2016-08-04,2016-08-09,True,Discuss enter spring today central continue fish where.
2013-10-09,2013-10-14,False,Week drop beautiful different own when true.
2013-06-02,2013-06-03,True,Child maybe million cell something off through.
2014-02-12,2014-02-14,True,Financial high light few cultural.
2017-11-28,2017-11-30,False,Us nature pull affect positive.
2011-01-27,2011-01-28,False,This figure assume if.
2016-09-01,2016-09-03,False,But because structure by decide draw garden.
2015-12-14,2015-12-17,False,Wonder southern option image radio although.
2017-11-13,2017-11-15,False,Your question book.
2016-10-16,2016-10-18,False,Seem address decade expert force.
2010-04-16,2010-04-19,False,Every newspaper in response employee serve table.
2016-10-05,2016-10-06,True,Stuff street put risk.
2016-03-02,2016-03-07,True,Respond sort most by response growth.
2014-05-16,2014-05-19,False,Step consumer newspaper court reality win single.
2010-07-22,2010-07-24,True,Under water key do offer water deal.
2012-10-01,2012-10-04,False,Over knowledge official sea eight consider.
2010-08-21,2010-08-26,True,Particularly turn democratic floor box fight clear.
2014-07-07,2014-07-12,False,Scene blue never want.
2017-05-16,2017-05-20,False,Box old indeed international issue energy.
2013-05-05,2013-05-06,True,Tv keep me product someone capital its.
2013-02-07,2013-02-11,True,Great girl single either.
2015-06-08,2015-06-09,True,Month himself draw risk strong treat.
2017-03-25,2017-03-29,False,Democrat usually the ask successful blue.
2012-10-31,2012-11-03,True,Young they deal power argue.
2012-03-06,2012-03-10,True,Child indeed major management even area.
2010-01-05,2010-01-06,True,Decide her like represent less surface.
2016-10-15,2016-10-18,False,Notice list degree painting.
2013-06-26,2013-06-27,False,Us dog tell doctor child.
2017-10-26,2017-10-29,True,Industry pick receive sea full.
2016-06-25,2016-06-28,False,Out degree decide not.
2011-02-15,2011-02-20,False,Local laugh long hand remember actually southern human.
2018-01-06,2018-01-07,True,Nice drop attorney partner.
2012-11-26,2012-11-27,True,Much majority college.
2010-06-22,2010-06-27,True,Beat office yard garden owner include.
2015-01-15,2015-01-20,False,Wish former go say Republican each.
2010-06-18,2010-06-19,True,Start every clear exactly keep must.
2016-07-11,2016-07-14,True,Ago stage number art suddenly throughout.
2014-02-21,2014-02-26,True,Prepare together cell you.
2014-11-02,2014-11-03,False,Important watch report decide where what cut.
2018-05-11,2018-05-14,True,Perform mean drive six and artist.
2015-07-03,2015-07-06,False,Couple usually brother teacher.
2011-11-09,2011-11-13,False,Anything reach single study someone personal level.
2013-07-21,2013-07-25,True,Discover series audience travel action sport.
2011-09-27,2011-10-01,True,Fight think your he wind away debate.
2015-12-11,2015-12-12,False,At man budget century heavy.
2017-12-08,2017-12-12,False,Clearly anyone should share as high.
2014-09-11,2014-09-13,False,Authority population fast knowledge.
2013-06-23,2013-06-28,False,He important message role woman three move.
2016-05-14,2016-05-19,True,Cell toward TV.
2014-01-13,2014-01-14,False,Religious throughout culture process choose.
2014-10-13,2014-10-15,True,Decide religious writer medical space success run according.
2015-10-20,2015-10-25,False,Blood range list simply.
2017-12-06,2017-12-07,False,Left several enjoy experience.
2014-07-14,2014-07-19,True,Method they discover health.
2015-01-24,2015-01-28,False,Red become buy bank five soon.
2015-11-03,2015-11-07,False,Different reach church more place want range.
2017-07-08,2017-07-09,False,Push else call adult.
2014-07-30,2014-07-31,True,Enjoy term step suffer style trouble.
2018-05-12,2018-05-14,False,Force born give suddenly similar manage.
2013-05-27,2013-06-01,True,Music along throughout what financial.
2015-11-06,2015-11-07,True,Social age tough couple.
2013-04-11,2013-04-16,True,Single population threat significant.
2011-06-13,2011-06-14,False,Commercial glass executive training.
2016-12-03,2016-12-05,False,Raise ten old large.
2013-11-03,2013-11-06,True,Suffer local wonder under.
2018-06-14,2018-06-19,False,Very focus own anyone care.
2011-12-12,2011-12-17,False,Listen support understand bit admit would.
2015-12-01,2015-12-05,False,Chair likely him those past technology.
2013-12-01,2013-12-04,False,Bank provide finally great her.
2013-05-12,2013-05-15,False,Carry anyone people doctor what later.
2011-07-21,2011-07-24,False,Commercial religious health result foot country.
2018-02-11,2018-02-13,True,My and along else.
2018-09-26,2018-09-28,True,Machine site past common when.
2013-08-15,2013-08-17,False,Team way animal include service religious strong.
2010-04-27,2010-04-28,False,Direction address need less trial.
2013-12-28,2013-12-29,True,Heavy participant treat despite effort true.
2015-05-22,2015-05-23,False,Couple reveal voice.
2012-08-16,2012-08-20,True,Hair involve such site.
2016-06-12,2016-06-17,True,Behind throughout actually strategy seem memory character piece.
2010-03-31,2010-04-01,True,Country class ahead young success.
2016-12-26,2016-12-30,True,Section compare world outside certain.
2014-11-25,2014-11-29,False,Budget market new common.
2016-05-12,2016-05-16,False,Truth outside girl compare.
2011-12-04,2011-12-08,False,Yeah high computer she you north present memory.
2010-10-31,2010-11-03,True,Pm generation machine skill.
2013-11-18,2013-11-21,True,Suddenly let party here.
2017-02-25,2017-03-02,True,It high manager million wear professor drop.
2014-09-20,2014-09-21,True,White usually pass down win where environment.
2017-12-31,2018-01-03,False,Student stand concern life.
2016-12-17,2016-12-22,False,Generation break ten see.
2015-10-30,2015-11-01,False,Meet answer without management national.
2015-12-25,2015-12-27,True,Certainly talk pressure imagine ready by staff.
2012-12-29,2012-12-31,False,Accept church character kitchen future over after.
2015-03-16,2015-03-18,True,There majority inside.
2014-01-13,2014-01-18,True,Maybe field positive.
2014-05-14,2014-05-15,True,Draw specific field wrong any during my.
2012-01-20,2012-01-25,True,Prove strategy day training financial Congress kid.
2014-12-07,2014-12-12,True,I prove forget light us.
2012-02-20,2012-02-25,False,Animal do agree bill.
2014-12-16,2014-12-17,True,Control game by individual try home establish admit.
2014-08-20,2014-08-24,False,Fly brother where son.
2016-01-13,2016-01-16,True,Public sound talk public note.
2013-05-28,2013-06-02,False,Base south important course concern activity direction than.
2011-09-29,2011-10-02,False,The green commercial outside follow join.
2016-02-14,2016-02-15,False,Station hard memory bed rest.
2018-11-14,2018-11-18,True,Protect few course truth at happy.
2018-08-18,2018-08-20,True,Buy involve sister alone usually owner since.
2013-02-23,2013-02-24,False,Need baby decision relate reveal past activity.
2018-06-02,2018-06-03,True,Recently million worker.
2015-02-19,2015-02-21,True,Region now author western.
2017-07-18,2017-07-20,True,Miss area adult scene management.
2015-03-19,2015-03-21,True,Idea along fear across executive.
2018-03-25,2018-03-29,False,Rest physical travel do western spring player.
2013-02-04,2013-02-09,True,Minute data team call ten time a.
2016-05-09,2016-05-11,True,Maybe above look six put notice practice.
2017-05-26,2017-05-30,False,Answer blue happy position change.
2017-04-25,2017-04-27,True,Although impact key who visit final father.
2011-10-08,2011-10-11,True,Bit computer three drop.
2015-10-10,2015-10-12,False,Protect less where indeed store their hard.
2014-11-06,2014-11-11,False,Focus throughout box wear money.
2011-11-07,2011-11-11,True,Region lose statement scene claim box oil enter.
2010-07-22,2010-07-24,True,Second her as.
2015-12-19,2015-12-23,False,Commercial it open owner child yard white know.
2011-03-21,2011-03-26,False,Over or head recognize interview care agency.
2012-09-07,2012-09-09,True,Measure alone community.
2010-08-17,2010-08-21,False,Theory discover soldier when lot door.
2018-02-12,2018-02-13,True,Mother under compare feel alone.
2013-03-07,2013-03-08,False,Imagine hard coach recognize magazine yet.
2012-09-30,2012-10-01,False,Responsibility fund skill language.
2014-09-12,2014-09-17,True,Artist quickly dark light learn wrong institution green.
2012-05-07,2012-05-08,True,Agree her different sign material check growth.
2013-04-10,2013-04-15,True,Painting ask public beautiful know woman religious popular.
2011-06-26,2011-06-27,False,Skill improve poor tough.
2013-11-04,2013-11-05,False,Employee almost federal similar lose.
2015-08-10,2015-08-14,True,Activity since interest while peace else wide.
2011-11-08,2011-11-11,True,Onto candidate compare set.
2017-08-10,2017-08-15,False,Response pull mouth.
2014-10-28,2014-10-30,False,Once price few nor administration security really land.
2012-10-07,2012-10-12,False,Street baby first.
2015-01-12,2015-01-14,False,Speak mean court account.
2017-01-06,2017-01-07,True,Soon television game the room to under.
2014-07-09,2014-07-10,True,Mouth at far bit election.
2014-02-01,2014-02-06,True,During scene news.
2017-06-23,2017-06-27,False,Benefit least war.
2016-06-07,2016-06-12,False,Everyone individual test fish stuff mission.
2013-12-09,2013-12-14,True,Effect sound beat hot me bring.
2012-11-23,2012-11-25,False,Born situation visit similar old hold.
2018-04-21,2018-04-24,False,Likely scientist order under life brother.
2014-09-20,2014-09-23,True,Time anything bad another give every night right.
2011-10-28,2011-10-30,False,Wonder thing bar side memory matter example.
2011-03-26,2011-03-29,True,Yeah cause find participant top sit sister.
2014-01-06,2014-01-11,False,Next decade oil election parent much dark.
2016-09-24,2016-09-28,False,House plan maintain even bank save relationship.
2015-08-13,2015-08-16,False,City age hundred health marriage modern performance that.
2017-12-29,2018-01-03,True,Manager most natural little reflect.
2015-02-27,2015-03-01,False,Together news past will.
2018-08-24,2018-08-29,False,Always so itself describe per too defense.
2015-03-06,2015-03-10,True,Only even ground thank mother local miss.
2013-03-14,2013-03-17,True,Lawyer thing goal interview.
2016-07-30,2016-08-04,False,So detail always foreign within push beyond.
2011-01-18,2011-01-22,False,Treat popular cultural catch though popular more.
2017-07-30,2017-08-04,True,Best conference family view network difference.
2012-01-12,2012-01-14,False,Give material financial various.
2015-12-28,2015-12-31,False,Challenge soon week leg bar whose student should.
2015-08-03,2015-08-08,False,Place first affect happen yet quality.
2011-02-08,2011-02-12,False,Recent story news again stay pull.
2016-02-02,2016-02-03,False,Political drug itself.
2010-03-11,2010-03-13,False,Person weight whom.
2011-11-29,2011-12-03,True,Sort prove decide money term picture week.
2018-05-09,2018-05-10,True,Drive friend grow.
2012-07-29,2012-07-30,True,Around school church catch federal sort.
2017-04-17,2017-04-22,False,Above worry significant fear improve.
2013-04-14,2013-04-16,True,Enter politics range half condition.
2011-06-02,2011-06-03,True,According card beyond.
2015-10-10,2015-10-11,True,Report arrive research hard.
2013-04-18,2013-04-22,False,Interest machine medical according sport say.
2011-01-25,2011-01-27,False,Push collection floor.
2015-07-20,2015-07-22,False,Man how military family either keep.
2015-04-10,2015-04-15,False,Writer summer stop probably.
2015-02-18,2015-02-22,True,Include continue recognize thousand west set.
2017-12-29,2017-12-31,False,Professional democratic statement former share.
2010-10-29,2010-10-31,False,Bring likely someone free kid sense but bill.
2015-03-16,2015-03-18,False,Two election less law.
2013-05-16,2013-05-18,False,Stock hospital social police professional.
2015-10-24,2015-10-26,True,Public land only your.
2010-11-18,2010-11-22,True,Fly walk class have task information seem.
2013-03-01,2013-03-04,True,Someone baby for heart surface.
2013-03-10,2013-03-11,False,International wind national matter friend administration.
2016-07-02,2016-07-03,True,Media hair worker film it.
2014-04-29,2014-05-01,True,Hold maintain eat town same health.
2017-12-26,2017-12-27,True,Together south close huge heart.
2011-12-23,2011-12-26,False,Himself summer item kind although.
2017-08-20,2017-08-21,True,Nor top now they.
2010-11-11,2010-11-13,True,Box value store car suffer.
2011-04-21,2011-04-22,True,Number arrive role bad affect high easy.
2016-01-05,2016-01-09,False,Get could sense often fine.
2013-04-20,2013-04-25,True,Agency good report successful rule gun actually.
2018-08-04,2018-08-05,True,Apply we analysis project.
2013-05-01,2013-05-04,False,Idea half camera sure section front garden.
2015-09-22,2015-09-26,True,Maintain employee with write team.
2017-09-20,2017-09-24,False,Game tough run region above.
2017-09-30,2017-10-03,False,List like operation south include.
2017-12-23,2017-12-28,True,Ahead yard American fast work area go.
2011-03-03,2011-03-08,True,Work see ground pressure rest box information her.
2013-02-25,2013-02-26,True,Reason land test several challenge.
2016-11-24,2016-11-29,True,Determine form executive camera.
2012-11-06,2012-11-08,False,Now late ok relationship war pay spend.
2011-03-02,2011-03-07,False,More building affect without.
2015-10-05,2015-10-07,True,Good camera major we various window.
2017-09-26,2017-09-29,False,Pull forget own image ask particular turn.
2014-12-21,2014-12-26,True,Rich note recent economy.
2014-04-30,2014-05-01,False,Above only ability.
2011-12-11,2011-12-14,True,Find laugh that.
2010-07-13,2010-07-18,True,Letter appear black.
2014-01-03,2014-01-04,False,Seem herself money another.
2011-12-15,2011-12-16,True,We treatment in dark economic.
2015-09-05,2015-09-09,True,North leg wonder kind clear.
2014-12-09,2014-12-12,False,Help experience total nothing case get program.
2015-05-02,2015-05-06,False,Shake whose some purpose.
2015-04-19,2015-04-24,True,Happen family campaign find police.
2013-12-27,2013-12-29,False,Section argue image policy song.
2017-06-14,2017-06-16,True,Break local chance interesting pretty still.
2015-01-31,2015-02-03,True,Large traditional goal gas town fish establish each.
2016-07-12,2016-07-13,True,Much girl beyond bank.
2012-10-21,2012-10-25,False,On message expert hotel season firm trouble.
2015-11-29,2015-12-03,False,Future least almost offer.
2016-05-17,2016-05-21,False,Within later window cover summer.
2014-06-20,2014-06-25,False,Hour especially newspaper method third.
2010-09-26,2010-09-29,True,Huge cultural per well none.
2013-01-23,2013-01-27,True,First though event star Mrs blue.
2016-02-27,2016-03-03,False,For news can of employee scene.
2010-01-06,2010-01-10,True,Land big draw skin which article condition world.
2017-08-03,2017-08-06,False,Certainly Mrs seat hair what fill.
2010-08-25,2010-08-28,True,Many manage source among it listen trial station.
2017-04-30,2017-05-03,False,Person himself simply sea top live effect.
2016-12-29,2017-01-03,False,About forward skill young resource guy difficult.
2015-10-23,2015-10-24,False,These worry television pay agreement.
2017-07-05,2017-07-07,False,Reveal wife hot result paper ok.
2014-06-26,2014-06-30,True,Term eye pick kitchen third.
2015-07-27,2015-07-29,False,Respond style must event.
2013-10-02,2013-10-05,False,Than position science most after floor moment.
2017-10-03,2017-10-07,False,Me last way still specific sure have course.
2017-01-30,2017-02-01,True,Although east whole term police take choice.
2014-06-01,2014-06-02,False,During state more former foot pull design.
2011-06-20,2011-06-23,False,Hand news adult size never history smile.
2010-01-06,2010-01-10,False,Try agency Mrs store interesting later food.
2010-07-31,2010-08-03,True,Door ball management record final role trouble.
2011-05-21,2011-05-26,True,Think water me newspaper center sure teacher.
2018-07-23,2018-07-24,True,Blood production hand.
2011-04-01,2011-04-03,False,Will parent few.
2010-10-13,2010-10-17,True,Purpose president simply suddenly.
2018-08-27,2018-08-30,False,Power animal defense seem be spend painting.
