2010-02-20,2010-02-23,False,Prepare anything should.
2018-02-09,2018-02-12,False,Country better majority themselves.
2012-05-30,2012-06-02,True,Head turn claim someone with.
2017-05-09,2017-05-14,False,Everything worker unit pay fast surface body.
2016-09-23,2016-09-24,False,Accept statement win.
2016-08-28,2016-09-02,False,Put more treatment best bag task break.
2013-07-21,2013-07-25,True,Foot quality give them.
2010-11-26,2010-12-01,True,Plan tree court low huge.
2012-05-07,2012-05-11,True,Series get record role magazine.
2012-03-24,2012-03-28,True,Ball culture bill those sell section role.
2010-09-14,2010-09-16,False,Policy brother voice statement cause.
2010-02-14,2010-02-15,False,Sign style near can may week be window.
2012-12-16,2012-12-18,True,Education of fast everyone.
2014-06-26,2014-06-28,True,Plant since interest sell wish.
2015-06-21,2015-06-25,False,Culture talk a them.
2013-04-08,2013-04-12,False,Best sell common common.
2013-07-19,2013-07-22,True,Consider same interview national next.
2013-06-23,2013-06-25,True,Such dinner pressure minute.
2014-04-27,2014-05-01,True,Indeed point recently throughout child happy.
2013-12-18,2013-12-22,False,Name may bed by individual wear impact.
2015-12-29,2016-01-03,True,Production lose trip.
2017-09-23,2017-09-24,True,Range every race line stock.
2016-03-08,2016-03-09,False,Rate safe force business.
2015-02-11,2015-02-13,True,May administration against sign.
2016-06-05,2016-06-08,True,Tough Mr course and.
2012-10-18,2012-10-23,True,Give exactly chance gun.
2011-03-22,2011-03-23,False,Much face personal represent against.
2014-04-06,2014-04-11,True,Senior measure professor store stage.
2018-08-06,2018-08-10,True,American thousand travel available sister push move.
2018-10-17,2018-10-19,False,Heart crime pass teacher.
2012-02-11,2012-02-15,False,Past cup wind.
2014-05-08,2014-05-09,False,Cultural manage central your light involve population.
2016-10-27,2016-11-01,True,Inside question create prevent a social eat.
2018-03-27,2018-03-29,False,Good two moment experience organization.
2016-06-12,2016-06-16,True,Source memory describe word.
2014-10-17,2014-10-19,False,Which leg debate fly easy.
2010-05-14,2010-05-17,False,Product image experience mention arm then hit.
2018-07-22,2018-07-24,False,Interest clearly per they hard worker since.
2010-02-12,2010-02-16,True,Partner state light.
2013-11-19,2013-11-20,False,Work another very understand black lay.
2017-01-12,2017-01-14,True,Item challenge rich their system exist.
2016-03-22,2016-03-27,True,Real after set they.
2018-09-19,2018-09-23,True,For world contain list.
2016-02-29,2016-03-02,True,But scientist yes store east you.
2017-08-10,2017-08-13,True,Everything decide choose though hit discussion onto.
2018-11-19,2018-11-20,False,Any building window trade activity.
2010-11-27,2010-11-29,False,Morning protect new officer career fight.
2012-10-27,2012-11-01,True,Office amount edge form best decade.
2016-04-12,2016-04-16,True,Pressure night seek positive.
2016-09-21,2016-09-22,False,Someone environment movie push us.
2015-01-11,2015-01-14,True,Yes product budget national director body.
2013-07-13,2013-07-14,True,Nature she popular.
2016-03-20,2016-03-24,True,Again value service language.
2017-02-09,2017-02-11,False,Smile simple sit something early.
2015-10-11,2015-10-15,True,Get financial man finally class growth.
2015-09-09,2015-09-12,True,Explain response or discover rise relationship loss.
2013-11-27,2013-11-29,False,Food management investment police leg company.
2015-08-12,2015-08-16,False,Note quickly suffer.
2011-02-21,2011-02-26,False,Huge fine almost relate color left.
2011-07-03,2011-07-05,True,As himself town own next matter themselves while.
2016-10-09,2016-10-12,True,Either site practice meet into such.
2016-01-04,2016-01-07,False,Bill vote letter book.
2012-05-01,2012-05-04,False,The away personal country candidate guy good.
2017-05-19,2017-05-23,True,Foreign worker both.
2012-05-15,2012-05-16,False,Picture tough site almost.
2013-06-10,2013-06-14,True,Represent marriage wear offer value.
2016-03-07,2016-03-11,False,Arm bag glass serious event certainly.
2012-10-23,2012-10-26,False,Born people difference.
2012-01-17,2012-01-22,True,Into protect bill road join.
2012-04-21,2012-04-24,False,Try realize almost beyond rock total likely.
2016-09-05,2016-09-06,True,Long us appear win their.
2011-06-01,2011-06-04,True,Hair expert approach teacher.
2011-01-07,2011-01-08,False,Attorney difficult late world similar performance standard recognize.
2012-08-30,2012-09-04,False,Speak general when expert later.
2013-01-26,2013-01-27,False,Yourself throw stage morning range common.
2012-10-11,2012-10-13,False,Some career phone serious.
2012-10-14,2012-10-19,True,Happy democratic TV spring.
2013-02-20,2013-02-23,False,Use will remain cause mean low always.
2017-10-28,2017-11-01,True,The policy true where.
2016-06-24,2016-06-26,False,Guy finish force after or next travel.
2011-04-11,2011-04-15,True,Affect outside stay from.
2018-07-23,2018-07-26,True,Administration any sea seven.
2014-02-20,2014-02-21,True,Also explain answer across.
2013-09-24,2013-09-29,False,Writer late child whom.
2013-11-06,2013-11-10,True,Analysis year smile morning.
2010-06-16,2010-06-18,False,Present responsibility back word.
2010-11-21,2010-11-24,False,Strategy piece idea future.
2010-01-22,2010-01-27,True,Full word common people seat great our.
2011-06-26,2011-06-27,True,Show result second experience phone run.
2017-07-17,2017-07-22,True,Wife develop order reason.
2013-06-01,2013-06-02,False,Realize physical fire message main.
2013-03-02,2013-03-03,True,Door concern set also guy.
2017-04-02,2017-04-07,False,House generation art mouth traditional.
2011-02-01,2011-02-05,True,Wall painting key ball feeling pass.
2018-01-25,2018-01-26,False,Do reason notice.
2017-07-21,2017-07-23,False,Shoulder actually in serve a common.
2014-09-14,2014-09-16,True,Ball maintain hot doctor such.
2012-06-04,2012-06-07,True,Able choose power out impact.
2017-10-03,2017-10-05,True,Evidence professor would various occur customer.
2015-09-23,2015-09-26,False,Face ago movie important want.
2012-03-02,2012-03-06,True,How would military.
2014-04-12,2014-04-15,True,Despite hold along huge his.
2017-07-03,2017-07-06,False,Design store interview bill alone follow movement.
2014-10-03,2014-10-06,True,Democratic go score necessary person.
2011-03-12,2011-03-16,False,Whatever people office contain.
2016-08-18,2016-08-19,True,During we job today.
2014-03-14,2014-03-16,False,Letter happy machine public tax.
2018-07-19,2018-07-20,False,Stock expert here.
2013-10-22,2013-10-27,True,Much control single ability Congress study war.
2012-04-10,2012-04-12,True,Consider others use.
2016-03-19,2016-03-23,False,Area huge trip either.
2015-10-16,2015-10-21,False,Animal executive most serious affect put result memory.
2014-07-13,2014-07-16,False,Drug argue majority sing what.
2013-08-31,2013-09-01,False,Against shoulder style suffer mean leader.
2012-10-15,2012-10-19,False,Ball skin book short.
2011-07-19,2011-07-20,True,On project hospital why a Republican choose.
2016-03-20,2016-03-24,True,Firm past either who.
2013-04-24,2013-04-29,True,Why water beat decade.
2010-01-05,2010-01-08,False,State explain civil seek.
2013-01-18,2013-01-19,True,Top house per physical.
2015-06-24,2015-06-28,True,Six least answer surface executive.
2016-10-25,2016-10-26,False,Reflect site improve thank.
2015-08-14,2015-08-15,True,Gun Mrs ten baby size occur manager wife.
2017-07-16,2017-07-17,True,Edge film figure way lay kid lose.
2012-09-30,2012-10-04,True,Ago serious next.
2013-11-20,2013-11-22,False,Congress somebody least morning.
2018-08-11,2018-08-12,True,Reach environmental learn success.
2013-11-28,2013-12-03,True,Keep sit feeling candidate place.
2011-12-20,2011-12-21,False,Sound rule concern outside.
2013-02-21,2013-02-25,False,Difficult somebody product ask leg management.
2015-06-21,2015-06-22,False,If marriage loss see.
2013-11-26,2013-11-30,True,Sure nice lead design.
2016-07-09,2016-07-13,False,Plant reduce protect there beyond above color information.
2018-10-07,2018-10-08,False,Worry prevent first same.
2015-06-27,2015-07-01,False,Rate modern occur month even new section.
2012-07-16,2012-07-20,True,Garden machine with partner compare mean.
2013-05-10,2013-05-15,False,Part positive national meet her recently message gas.
2018-11-13,2018-11-14,True,Worker can member ground month exactly agreement.
2015-11-02,2015-11-06,False,Late offer situation reality leg.
2014-05-24,2014-05-27,True,Wide knowledge cup past.
2011-11-20,2011-11-24,False,Debate will about half.
2016-05-22,2016-05-23,True,Change only majority need.
2014-11-17,2014-11-22,True,Hot over green page the ever increase accept.
2010-06-25,2010-06-27,False,Color tend foot not foreign sister opportunity give.
2015-12-18,2015-12-20,True,Over take happen.
2018-03-11,2018-03-16,False,Cover situation land southern.
2012-02-20,2012-02-24,False,Senior she try west organization history generation.
2017-05-26,2017-05-30,False,Want wear system create industry sound dark risk.
2011-10-01,2011-10-06,True,Present action report record.
2017-06-11,2017-06-13,True,Responsibility health picture natural writer part share.
2017-08-23,2017-08-26,False,Manage plan but likely set choice.
2016-11-11,2016-11-16,False,Hold maybe exactly create back prepare.
2018-02-27,2018-03-04,True,Least listen push region.
2017-08-27,2017-09-01,True,Deal food hospital building.
2014-07-18,2014-07-21,True,General relate own now culture nor.
2017-02-09,2017-02-14,True,Moment education ok same prepare kind measure.
2014-02-18,2014-02-23,True,Wind kind lose.
2010-05-19,2010-05-23,False,Lose tough threat leg.
2011-11-21,2011-11-24,False,Three night effect maintain serve occur then.
2012-10-20,2012-10-24,True,Hand start range course style.
2010-04-29,2010-04-30,True,Arrive result until team thank moment.
2010-02-04,2010-02-05,False,Language it fall sell which.
2015-09-23,2015-09-28,True,Like eat effect major.
2011-01-17,2011-01-22,True,Large professional person watch vote.
2016-09-11,2016-09-15,True,Animal break soldier.
2017-03-10,2017-03-11,True,Several star free task exist much attention.
2018-10-02,2018-10-05,False,Arrive well point special base administration.
2016-05-29,2016-05-30,True,Practice whatever newspaper heavy exist question.
2012-07-14,2012-07-18,True,Check theory particular who positive amount.
2014-09-22,2014-09-25,True,Company four public management increase even.
2012-08-01,2012-08-02,True,May late begin develop try more.
2010-12-17,2010-12-18,False,Allow near ahead career prove.
2012-11-29,2012-11-30,True,Direction design leader protect.
2013-09-07,2013-09-10,True,Represent another attorney voice.
2015-11-19,2015-11-20,False,Finish age quickly standard into adult.
2017-05-24,2017-05-29,False,Space candidate during strategy agent.
2013-03-04,2013-03-06,False,Letter against occur paper.
2011-06-17,2011-06-18,False,Oil give material mention owner.
2017-05-07,2017-05-12,False,Magazine response population into just meeting.
2012-09-07,2012-09-10,True,During administration dinner necessary stop test event.
2014-08-29,2014-08-31,True,Approach book worker step return blood answer.
2011-05-27,2011-05-30,False,Experience child hot former economic price air.
2011-04-15,2011-04-20,False,According front easy very.
2012-04-05,2012-04-09,False,In increase response by send particular.
2013-05-02,2013-05-06,True,Down economic key against data whole.
2016-05-22,2016-05-23,True,While benefit two marriage wear.
2016-06-29,2016-07-04,True,Democrat item throughout energy join nearly.
2011-12-26,2011-12-31,True,Security the wish physical former my.
2012-09-01,2012-09-06,False,Dog necessary common example early environmental force.
2015-08-16,2015-08-19,True,Claim find yeah heart.
2014-02-09,2014-02-11,True,Strong again his hit including.
2017-07-02,2017-07-07,True,See popular effect debate personal.
2013-10-21,2013-10-26,True,Blue assume light.
2012-10-27,2012-10-29,True,Any travel economy real area.
2016-11-30,2016-12-03,False,Government present line go yes agree.
2017-04-12,2017-04-16,False,Study box hope affect today why.
2016-05-15,2016-05-16,False,Both of story.
2014-09-13,2014-09-17,False,Free easy garden floor end star cut.
2013-03-29,2013-04-01,True,Stock must ground.
2016-04-18,2016-04-21,False,President say away wonder.
2017-03-21,2017-03-24,True,Physical decision lose star.
2011-09-30,2011-10-01,False,Natural parent front more.
2013-01-31,2013-02-02,True,Thus defense six market win stand.
2010-12-27,2010-12-29,False,Director officer law message investment note while.
2010-11-12,2010-11-14,True,Capital change talk why half.
2010-10-13,2010-10-18,False,Country special marriage law cut.
2014-11-21,2014-11-25,False,Letter step page inside evening.
2011-07-14,2011-07-18,False,Boy hit whole read off everything.
2015-02-19,2015-02-22,False,Prepare especially true behind answer other player.
2016-05-31,2016-06-05,False,Test fight law.
2011-03-20,2011-03-23,True,Teacher social will dinner pretty.
2017-08-07,2017-08-08,True,Machine know recognize prove still detail.
2016-08-01,2016-08-05,True,Drop other large early seat.
2018-05-29,2018-06-01,False,Report lawyer seven little wrong central radio character.
2018-01-23,2018-01-24,True,Party among report tend.
2011-10-14,2011-10-15,True,Without modern approach leg.
2012-11-28,2012-12-01,False,Same president natural prove fish.
2016-09-08,2016-09-12,True,Beyond top agent little.
2016-02-13,2016-02-18,True,Data during white story window food themselves.
2010-06-06,2010-06-08,False,Southern material whatever relate.
2010-01-03,2010-01-05,True,Guy food wall production range present.
2017-01-23,2017-01-25,False,No whatever save authority gas thousand.
2017-06-22,2017-06-27,False,Manage throw these adult visit bank.
2013-09-08,2013-09-09,False,Allow turn point onto by other.
2015-12-04,2015-12-07,True,Or important great their.
2014-06-12,2014-06-17,True,Election identify ground history floor.
2012-03-21,2012-03-23,True,Chance husband economy everyone majority lose environment.
2018-01-01,2018-01-02,True,Wall certainly sense level by.
2010-03-05,2010-03-08,True,Art realize also bar interview pretty.
2018-03-20,2018-03-24,True,Often practice purpose tonight never well.
2017-07-29,2017-08-01,False,Kitchen together among seem process beyond.
2011-08-31,2011-09-05,True,Key wrong wish rate again top.
2010-02-09,2010-02-14,True,Foot enjoy family major decide.
2015-01-14,2015-01-17,False,Alone vote dark culture hope.
2018-06-11,2018-06-12,False,Friend difficult meet home source true market.
2016-12-22,2016-12-26,False,Herself spend recent worker show.
2016-02-16,2016-02-21,False,Friend report question recently military per.
2011-03-14,2011-03-16,True,Project participant unit weight candidate live he.
2014-09-03,2014-09-06,False,When base reach travel strategy somebody.
2014-03-14,2014-03-18,False,Change charge now media data.
2017-08-13,2017-08-14,True,Car though religious money.
2011-03-01,2011-03-05,False,Recognize agree market strong a reveal son.
2017-07-27,2017-07-29,False,People among your trial top do young.
2010-11-16,2010-11-21,False,Carry yard question TV teacher serious very.
2017-06-18,2017-06-20,False,Program development development plan out worker carry.
2017-05-20,2017-05-25,True,Crime drug whom out film participant easy.
2014-01-28,2014-01-29,False,Significant future go affect.
2010-10-24,2010-10-28,True,Whole deep meeting.
2018-01-25,2018-01-28,False,Though tough population despite yard.
2014-07-07,2014-07-08,True,Partner attack bag surface listen.
2010-05-18,2010-05-20,True,Kid tax enter message.
2017-10-06,2017-10-10,True,Main fire quite with story allow.
2015-03-13,2015-03-18,True,Physical situation gun seven.
2014-07-29,2014-08-01,False,Factor best particularly sort save second institution.
2010-12-20,2010-12-21,True,Actually one population pretty market.
2010-11-19,2010-11-22,True,Entire per Congress it major note blood.
2011-01-01,2011-01-03,False,Chance forget huge happen thank town.
2011-01-19,2011-01-21,True,Environment prevent pull reality.
2014-03-06,2014-03-10,False,Interesting peace lawyer serious pass network.
2010-04-23,2010-04-28,False,Option glass their.
2014-07-02,2014-07-06,True,His I American relationship great decide.
2014-06-15,2014-06-18,True,One arm would.
2015-05-03,2015-05-04,True,Charge tough mission capital.
2010-10-22,2010-10-23,False,Door seem simply teach officer.
2011-10-09,2011-10-13,True,That learn billion keep future.
2015-05-30,2015-06-04,True,Past score staff there media.
2016-03-05,2016-03-08,True,Morning attention environmental open common.
2013-09-24,2013-09-25,False,Nature statement stop bad herself indicate.
2016-06-16,2016-06-21,False,Poor discuss cell let campaign teacher service.
2010-07-19,2010-07-24,True,Billion pattern drop election billion fire.
2011-10-05,2011-10-08,True,Officer here increase quite ball good.
2013-01-25,2013-01-26,True,Be true particularly move cultural.
2013-06-19,2013-06-21,False,Safe serve manage miss.
2017-07-04,2017-07-09,True,Member mouth style bring society.
2017-05-31,2017-06-02,True,Occur report arm concern remain half.
2018-11-09,2018-11-14,False,Million group this film police.
2013-12-18,2013-12-20,False,Tend production health strong paper century pretty.
2014-02-28,2014-03-05,False,Man feel consumer Mrs professor.
2018-08-31,2018-09-03,False,So recognize magazine lead crime important.
2011-06-01,2011-06-02,True,Player rule success.
2014-04-22,2014-04-23,False,Source indicate him air create clear realize explain.
2012-03-04,2012-03-07,True,Cell woman sign baby play never section.
2017-02-26,2017-02-28,False,Economic indeed least.
2013-02-17,2013-02-21,False,During wall compare.
2014-05-30,2014-06-03,True,Market enjoy citizen expect movie leave like.
2013-07-21,2013-07-23,True,Name over effect us leader most.
2012-10-02,2012-10-03,False,Behavior development alone.
2014-10-30,2014-11-02,True,Vote according experience activity prevent movement money.
2016-06-06,2016-06-07,True,Create among forward you war.
2012-04-10,2012-04-11,False,Right news political rule.
2018-05-13,2018-05-17,False,Husband although exactly task organization table board character.
2011-04-28,2011-04-29,False,Never policy standard discuss note or him.
2018-09-13,2018-09-18,False,Television serious card him drug politics ball.
2011-02-05,2011-02-10,True,Continue about should finally trade.
2015-05-05,2015-05-10,False,True time follow do base.
2013-07-05,2013-07-10,False,Letter physical mission remain today.
2015-11-03,2015-11-07,True,Whole project assume market.
2017-08-18,2017-08-22,False,Assume morning bar data might clearly.
2012-04-27,2012-05-01,True,Door performance lay look rest major on sea.
2012-11-13,2012-11-14,False,Article control our when south office among.
2011-07-02,2011-07-05,True,Onto east rise magazine fill direction.
2010-12-19,2010-12-24,False,Industry he security.
2017-07-19,2017-07-21,False,Month meeting watch have less south.
2018-11-09,2018-11-14,True,Enjoy require task mention never.
2014-02-10,2014-02-15,True,Defense catch pretty subject do find summer.
2018-01-03,2018-01-07,True,Member hard keep drop bad.
2015-01-26,2015-01-27,False,Mr detail early vote town begin just.
2012-08-12,2012-08-13,False,Develop leave stand bar total wide energy.
2010-05-07,2010-05-08,False,Check identify market.
2018-02-27,2018-03-01,True,Positive put crime arrive hard.
2013-06-03,2013-06-07,True,Anyone site movement relate statement give change itself.
2010-02-25,2010-02-26,False,Common why child table civil cut.
2015-08-29,2015-08-31,False,Write else voice ground traditional structure.
2014-02-08,2014-02-10,False,Remember Congress often door.
2018-07-01,2018-07-04,False,Hope board listen suddenly easy sign.
2015-01-20,2015-01-24,False,Significant pressure build race paper knowledge method.
2013-01-20,2013-01-25,True,Amount over large seem friend way.
2012-03-13,2012-03-16,False,Memory will ask democratic kid a.
2010-12-14,2010-12-18,False,Court item ask.
2017-12-02,2017-12-03,False,Until culture these test air talk.
2018-01-20,2018-01-23,True,Direction budget second break soldier.
2011-07-26,2011-07-27,True,Stuff me expect ability range in.
2010-11-21,2010-11-24,False,Camera rise claim fact still news interesting war.
2016-06-02,2016-06-06,False,South billion left however.
2010-11-24,2010-11-29,False,Behind have be top agent.
2016-04-14,2016-04-19,False,Space how sure line eat culture economy yeah.
2016-04-07,2016-04-09,False,Decision despite system total.
2016-10-18,2016-10-22,False,Enjoy see guess reveal.
2018-07-17,2018-07-21,False,Call black whom represent sometimes miss.
2018-05-11,2018-05-12,True,Next owner professor simple.
2015-01-07,2015-01-08,True,Game reality say along decade affect.
2018-09-29,2018-10-03,True,Performance poor share information most old.
2014-12-25,2014-12-30,False,Figure capital pull project area.
2017-08-11,2017-08-12,True,Remember source deal.
2018-03-04,2018-03-09,True,Themselves whole one side large born.
2013-04-28,2013-05-02,False,Quickly garden last.
2012-10-30,2012-11-03,True,Coach center grow project never.
2014-01-04,2014-01-06,False,Clearly recent impact court day talk.
2014-05-18,2014-05-20,False,Type two bit throw personal.
2012-08-22,2012-08-25,False,Whose nice ask professional paper just.
2013-10-01,2013-10-02,False,Use walk fire himself enough participant.
2013-10-23,2013-10-25,False,Use miss line chair ahead own.
2013-05-12,2013-05-13,True,Realize south medical argue after should idea.
2015-05-09,2015-05-12,True,Scientist pass number simple apply thousand follow material.
2011-01-02,2011-01-06,False,Short wind break set everyone hair.
2016-03-14,2016-03-15,True,Fast sell gas space economy fine fact.
2014-12-22,2014-12-23,False,Our move player her sound.
2017-09-14,2017-09-18,True,Language condition begin laugh street specific.
2015-11-26,2015-11-27,False,Toward section maybe rich.
2018-01-20,2018-01-24,True,Design the understand well I range beautiful.
2013-08-21,2013-08-22,True,Forward rather for great idea approach yard coach.
2010-03-08,2010-03-11,True,Drug book assume maintain.
2010-05-19,2010-05-21,True,To pattern more knowledge many.
2014-05-13,2014-05-18,False,Weight similar rich who of form course.
2018-06-06,2018-06-10,False,Compare simply than real.
2011-11-07,2011-11-10,False,Simple begin next off western soldier.
2013-08-16,2013-08-18,False,Spend not painting mention although sister.
2011-01-29,2011-02-01,False,How particularly loss positive blue against player.
2012-04-01,2012-04-03,True,Economy travel risk.
2012-01-11,2012-01-14,False,Have ahead go owner prevent PM.
2011-01-04,2011-01-05,True,Continue memory loss after school seek.
2017-01-25,2017-01-30,True,Win low accept I necessary.
2014-10-23,2014-10-28,False,Build admit wish husband.
2011-06-04,2011-06-05,False,School very could side door time.
2016-11-17,2016-11-22,False,Environmental short eat TV without.
2012-11-09,2012-11-14,False,Individual popular remember really game ok several hand.
2012-06-02,2012-06-05,True,Concern success blood word.
2017-04-25,2017-04-28,True,Career strong carry trade.
2017-02-03,2017-02-07,True,It could describe western offer.
2017-03-13,2017-03-15,True,Such will operation out.
2011-02-12,2011-02-13,True,Pm well standard better think.
2012-10-26,2012-10-28,True,Couple peace themselves game.
2017-10-15,2017-10-16,False,Choice until beat.
2010-01-12,2010-01-17,False,Purpose during if stand perform until.
2015-05-07,2015-05-09,False,Tell onto choice girl plant.
2010-04-06,2010-04-10,True,Upon space final quite north later.
2013-12-16,2013-12-18,True,Consider station young sister wait anyone hair.
2013-02-03,2013-02-05,True,Minute win wife month you friend political.
2010-06-16,2010-06-20,False,Dinner under every billion personal first game then.
2017-12-15,2017-12-19,False,Drive boy pass money prepare record.
2018-05-28,2018-06-01,True,Receive president human line pattern as.
2013-02-01,2013-02-03,True,Purpose politics middle.
2012-06-18,2012-06-20,False,Surface miss itself authority avoid.
2015-10-23,2015-10-24,False,Wonder little design chair fall what.
2018-11-07,2018-11-11,True,Imagine phone dream director.
2012-12-14,2012-12-17,False,Already top thus mean believe stock speak good.
2015-02-07,2015-02-10,True,Final other toward pressure green fine.
2014-09-24,2014-09-25,False,Use my kitchen join third where science.
2012-10-23,2012-10-26,False,World so exactly number situation she adult.
2013-04-01,2013-04-04,False,Cultural adult technology within lot into.
2013-05-22,2013-05-23,False,Future sport idea.
2018-03-21,2018-03-25,False,Put else hair language.
2016-04-03,2016-04-06,False,Base without rate have top important building.
2011-03-22,2011-03-27,True,Size cover shoulder own finish establish after.
2014-05-05,2014-05-10,False,Anyone network course down.
2010-07-18,2010-07-20,True,Yourself put recently I special.
2010-01-14,2010-01-17,True,Exactly finally relate first.
2017-08-04,2017-08-05,False,Sort article laugh event.
2017-03-04,2017-03-06,False,Mother positive mean economic.
2017-04-12,2017-04-16,True,Hotel network consider cover other several total.
2017-12-25,2017-12-28,False,Play interview of set evidence minute.
2014-01-21,2014-01-26,False,Above throw job room.
2010-01-28,2010-02-02,False,Society seven defense billion meet shoulder.
2010-12-28,2010-12-29,True,Memory medical morning front thousand describe perhaps.
2015-08-25,2015-08-29,True,Enter almost alone everything consumer.
2011-06-17,2011-06-20,True,And site yeah article baby deep example.
2012-07-23,2012-07-26,True,Return and us close issue throughout.
2013-12-05,2013-12-09,True,First ten show table knowledge plant.
2017-01-20,2017-01-24,True,Consumer each anything street body throw catch.
2012-04-18,2012-04-23,True,Appear economy may career herself manage reduce.
2012-11-05,2012-11-07,False,Employee blood cover true each method.
