2016-06-01,2016-06-03,False,Star movement wrong green town white red.
2016-04-05,2016-04-07,True,Sort place let member.
2016-05-27,2016-05-31,False,Common year performance candidate.
2011-06-22,2011-06-25,True,Southern American stand question wide not hear.
2011-02-10,2011-02-15,False,Response enjoy attack history any TV life product.
2011-10-06,2011-10-10,True,Agent artist choose benefit performance.
2017-06-20,2017-06-23,False,Job already use mind.
2017-10-31,2017-11-03,True,Into wrong staff pull.
2018-08-18,2018-08-20,False,Speech recognize along.
2012-06-14,2012-06-15,True,Place machine strategy hour.
2017-04-12,2017-04-13,True,Partner her baby improve happy.
2011-03-18,2011-03-22,True,Artist their western window still kitchen.
2015-02-17,2015-02-20,False,Clear look relate mean.
2014-05-01,2014-05-05,False,Respond new radio.
2013-03-16,2013-03-18,False,Figure memory anyone according along paper.
2014-03-17,2014-03-19,False,Operation perhaps generation power money low.
2014-05-15,2014-05-19,True,Very music company bank scene.
2015-10-30,2015-11-03,True,Develop word writer partner.
2011-05-12,2011-05-17,False,Baby here member action car pressure close everything.
2010-06-16,2010-06-19,False,House whatever daughter ready degree environmental.
2015-01-14,2015-01-19,True,Left likely know in finally method manage indeed.
2016-07-10,2016-07-12,True,Whom sport player whether.
2010-10-28,2010-10-31,True,Dark national fear.
2012-03-09,2012-03-12,True,Game participant explain laugh.
2015-12-04,2015-12-07,True,Get where song agree in new.
2018-11-05,2018-11-10,False,Too good son former air take.
2013-10-27,2013-11-01,True,Subject future production maybe beyond.
2013-12-10,2013-12-15,True,Visit garden life report new important.
2010-10-30,2010-11-04,True,Drug eye billion fill.
2011-12-03,2011-12-06,True,So book citizen serve issue.
2012-08-25,2012-08-29,True,Executive pattern strategy American born grow heavy.
2010-06-05,2010-06-06,False,Blood alone see loss.
2013-09-13,2013-09-18,False,Find piece parent new school.
2018-02-02,2018-02-04,False,True time easy sell man safe begin fine.
2017-06-07,2017-06-10,True,Student dinner station.
2014-09-22,2014-09-23,False,Dream respond society market art.
2015-12-27,2015-12-28,True,Authority threat through cold enter affect.
2015-11-07,2015-11-08,True,Enjoy these clearly example general fill.
2010-09-04,2010-09-09,False,Use them key only where mission present.
2014-06-27,2014-06-28,False,Science season perform image common need.
2013-04-07,2013-04-11,False,Shake item allow each many democratic TV.
2014-10-28,2014-10-30,False,Top along his owner city believe.
2017-12-01,2017-12-02,True,Training account determine range night.
2012-03-08,2012-03-12,False,Responsibility school environmental both yard.
2013-12-05,2013-12-09,True,They main traditional recognize.
2016-09-10,2016-09-13,False,Six edge carry power democratic report.
2013-06-01,2013-06-02,False,Five student under share southern prove all.
2017-06-14,2017-06-17,True,Know commercial laugh section.
2011-01-01,2011-01-03,True,Among six similar ago address visit allow.
2011-08-20,2011-08-21,False,Her future world occur.
2013-04-22,2013-04-27,False,Brother perform page manager morning we less.
2011-09-17,2011-09-18,True,President during accept increase spend.
2011-06-05,2011-06-07,False,Note garden common box.
2011-09-09,2011-09-11,False,Far activity shake mother foreign model.
2014-07-04,2014-07-09,True,Head better each key PM my.
2017-05-30,2017-05-31,True,Blood often perhaps book mean few.
2013-05-24,2013-05-26,True,Language sing year.
2010-09-21,2010-09-24,True,Marriage available take actually much generation occur.
2016-01-22,2016-01-27,True,Various green whole recognize follow lot.
2015-10-02,2015-10-03,False,Usually middle out see.
2012-11-24,2012-11-25,False,Poor upon evidence gun relate property.
2018-07-31,2018-08-02,True,Central must heart or design east moment.
2015-09-18,2015-09-19,True,Memory same film just range before.
2012-08-26,2012-08-29,True,Group type somebody one.
2016-09-02,2016-09-04,False,Rule ever movie cultural food positive friend.
2012-01-16,2012-01-21,True,Analysis allow word.
2017-03-29,2017-03-30,False,Help whom government TV.
2011-04-06,2011-04-07,False,Community them scene deal cut.
2015-08-01,2015-08-06,False,Board smile class place thus white.
2016-04-08,2016-04-13,False,Ever picture open note.
2015-12-25,2015-12-29,True,Size but establish full.
2016-04-20,2016-04-21,True,Loss prepare husband response.
2016-10-13,2016-10-16,False,Whom every most hear appear such ago.
2015-08-25,2015-08-30,True,By some economy situation gas.
2016-09-07,2016-09-11,False,Voice I those fish life actually former growth.
2016-09-26,2016-10-01,False,Money big available approach.
2012-10-27,2012-11-01,False,Hair compare participant hair section have.
2014-06-30,2014-07-03,False,Case answer up term money sister.
2017-10-16,2017-10-21,True,Throw call real total forward.
2017-05-14,2017-05-18,False,Safe debate director guy person town five.
2014-02-27,2014-02-28,False,Raise itself population pressure writer meeting do lawyer.
2011-08-06,2011-08-09,False,Only anyone sort federal development.
2016-11-28,2016-12-03,True,Such determine sister fill wall mind.
2010-02-25,2010-03-02,True,Doctor traditional body.
2011-08-04,2011-08-09,False,Speak item medical institution.
2017-04-29,2017-04-30,False,Organization reason recently save answer green fast.
2016-04-18,2016-04-23,False,Of church pull finish others.
2015-01-06,2015-01-09,False,Rate fall heavy key marriage north share.
2018-04-13,2018-04-18,True,Director article fear after short project.
2015-03-02,2015-03-07,False,Tonight future sign.
2017-10-12,2017-10-14,True,College role type address piece high meeting.
2018-02-05,2018-02-07,True,Among of husband social determine read suggest.
2018-09-27,2018-09-30,False,Democrat major seat dark make worry.
2015-10-31,2015-11-03,True,Pressure may protect role plan surface skin.
2010-01-27,2010-02-01,False,Former before never cup.
2012-07-02,2012-07-05,False,Authority entire drive type head stop from.
2018-05-11,2018-05-15,False,Main laugh treat stop main evening third.
2012-01-29,2012-02-01,True,Support toward lawyer international role.
2017-03-09,2017-03-14,False,Somebody toward my deal lot as draw.
2011-09-11,2011-09-15,True,Just energy sea direction.
2013-12-04,2013-12-06,True,Executive subject reason six share note information third.
2017-08-29,2017-08-30,True,Side eat door.
2014-09-10,2014-09-13,False,Fear something perhaps war.
2011-09-11,2011-09-12,False,Bank develop play.
2018-11-03,2018-11-06,False,Why short item.
2014-12-24,2014-12-25,False,Recent actually month prove include far.
2015-09-13,2015-09-15,True,Building little third crime natural campaign themselves.
2014-07-16,2014-07-20,True,Station talk attack myself perform watch move.
2011-05-03,2011-05-08,True,Military with will result commercial owner local.
2017-12-26,2017-12-29,False,Hour collection effect page each.
2010-01-27,2010-01-30,True,Remember TV smile social cell factor.
2013-02-24,2013-02-28,False,Concern join each some daughter present degree.
2013-01-14,2013-01-18,False,Others church year assume off themselves.
2012-09-20,2012-09-24,False,Conference ball should.
2015-04-15,2015-04-17,False,Another space whose memory energy body do.
2016-05-08,2016-05-13,True,Employee rather understand cup society whatever strategy.
2015-01-31,2015-02-02,False,Write character service section growth.
2018-11-02,2018-11-03,True,Administration worker break staff hard.
2014-05-22,2014-05-26,True,Put lay wrong office laugh manager.
2017-06-08,2017-06-13,False,Want talk ask land different compare effect.
2017-12-30,2018-01-04,False,Base gas try benefit international discover responsibility.
2014-10-27,2014-10-31,False,Large difference home candidate under along.
2018-05-05,2018-05-06,False,Area single interesting reality meeting up.
2012-01-23,2012-01-27,True,Degree house sort they.
2016-06-03,2016-06-07,True,Level dream house significant raise early.
2012-04-06,2012-04-11,False,Population early sound.
2015-04-12,2015-04-15,False,Represent about forget forget under not box.
2015-12-21,2015-12-25,True,Piece kid human tell nothing baby yes.
2011-03-09,2011-03-12,True,Study community that some.
2014-08-09,2014-08-11,False,Still tax way throw security seem put improve.
2010-07-28,2010-08-02,False,Head media hot.
2018-05-31,2018-06-01,False,Car improve Republican forget.
2017-04-20,2017-04-25,False,Example race seven by old allow prevent.
2017-07-24,2017-07-25,False,See piece difference.
2018-07-05,2018-07-07,False,She organization where day clearly deal production.
2013-11-20,2013-11-23,True,Personal professor learn agent class.
2012-03-24,2012-03-28,False,Up agreement discussion.
2014-12-24,2014-12-28,True,Third executive century appear themselves former sister when.
2012-01-23,2012-01-25,True,Main management computer sense myself picture age.
2012-08-13,2012-08-18,True,Science food Mrs every kid.
2011-12-19,2011-12-23,True,Field share must open understand maintain medical.
2015-01-15,2015-01-19,True,Fish lay likely white present.
2016-06-24,2016-06-27,False,Former cost his my pull should forward leave.
2018-06-07,2018-06-11,True,Bar support single computer idea floor able relationship.
2017-05-13,2017-05-18,True,Before suddenly police blue will.
2010-01-24,2010-01-25,False,Fall role for entire service big.
2017-08-07,2017-08-09,False,Man to send wife will dream item majority.
2010-12-04,2010-12-07,False,Half among cost show.
2012-08-03,2012-08-04,True,Beyond me practice clearly also.
2013-01-24,2013-01-28,True,Necessary daughter mother build.
2015-08-20,2015-08-25,False,Its smile style process area series.
2013-03-18,2013-03-20,True,Rock while entire avoid someone institution great.
2018-11-17,2018-11-18,False,Agency chair base actually American probably.
2014-12-03,2014-12-04,False,Her economy environment they.
2017-07-13,2017-07-14,True,Realize only drive shoulder.
2017-06-27,2017-06-28,True,Sport speak least.
2012-03-06,2012-03-10,False,Unit behind environmental.
2013-10-25,2013-10-30,False,Concern truth wide ten gas.
2011-06-03,2011-06-08,False,Health anyone candidate option who store economy.
2016-10-26,2016-10-28,True,Do growth daughter unit in when.
2016-07-28,2016-08-01,False,Animal on really activity read law range.
2014-03-09,2014-03-13,True,Enjoy hospital point history white technology.
2013-01-12,2013-01-16,True,Threat use understand although rather yet involve for.
2012-01-27,2012-01-30,True,Garden example officer treat last.
2010-07-18,2010-07-22,True,Still this across position maintain window reason.
2014-06-21,2014-06-26,True,Pull about agree beautiful cold different which.
2017-08-13,2017-08-18,False,From lay other culture describe financial travel.
2016-08-14,2016-08-16,True,Him citizen serve pressure him ever.
2013-05-12,2013-05-15,False,Property citizen interesting defense.
2017-01-31,2017-02-03,False,Total then something.
2010-07-13,2010-07-14,False,Woman whatever indeed election.
2017-03-24,2017-03-26,True,Cultural task finally art.
2017-07-15,2017-07-19,True,Follow early example change teach really thought.
2015-10-22,2015-10-24,True,Someone partner better your event long point.
2015-05-04,2015-05-07,False,Throughout market change stop middle while somebody.
2018-06-27,2018-07-02,True,Degree than least pay week.
2013-10-06,2013-10-10,False,Process whom discuss manager treat instead production.
2014-10-25,2014-10-26,True,Congress successful similar.
2010-08-03,2010-08-06,False,Spend health cost call defense.
2017-09-11,2017-09-15,True,Deep go fall difference happy church.
2010-10-23,2010-10-24,False,Door respond sure participant.
2015-08-09,2015-08-13,True,Church only occur amount security.
2012-10-17,2012-10-20,True,Risk actually true city that kitchen southern.
2017-06-04,2017-06-09,True,Perform theory nearly performance.
2017-05-17,2017-05-18,True,Interest face bar than turn medical.
2016-07-23,2016-07-25,True,Yeah daughter professor want worry.
2017-11-20,2017-11-22,True,Project successful case red anything significant rock.
2017-11-20,2017-11-21,True,Music imagine respond put movement.
2014-06-01,2014-06-06,True,World heart event keep.
2014-12-11,2014-12-13,True,Cause long government represent record arm.
2015-06-01,2015-06-04,False,Feeling walk gas rate accept cut quite.
2017-01-11,2017-01-15,False,Now type so child.
2015-02-11,2015-02-14,False,Surface story cell decision hard.
2011-06-23,2011-06-28,True,Least note wide help affect why morning eye.
2017-12-15,2017-12-20,True,Along issue imagine agent compare.
2016-02-09,2016-02-12,False,Quality sister bit.
2013-11-01,2013-11-03,False,Game left statement after fear.
2010-04-21,2010-04-22,True,Clear he reason grow.
2011-04-05,2011-04-09,False,Reach training bring article four.
2016-04-19,2016-04-21,True,Republican admit source matter.
2018-09-15,2018-09-17,False,Know he early.
2015-09-08,2015-09-13,False,Another back sort everyone real or.
2010-11-01,2010-11-02,False,Same bring once less.
2013-07-23,2013-07-27,False,Road society usually page.
2011-11-22,2011-11-26,True,Wait investment could direction evening control.
2014-06-23,2014-06-27,True,Standard accept open cause find.
2013-09-14,2013-09-19,True,Dark sense painting.
2012-08-19,2012-08-23,False,Significant minute town physical.
2016-01-02,2016-01-04,False,Mind threat suggest night building wear truth.
2017-04-30,2017-05-01,True,Practice then want director plan.
2016-05-11,2016-05-13,True,Others score note cultural son million.
2014-11-05,2014-11-06,True,Dark community debate somebody throughout live grow affect.
2017-03-01,2017-03-05,False,Identify itself certain deep hotel.
2011-06-20,2011-06-24,False,Score notice toward wall pass station.
2015-06-28,2015-06-30,False,Nothing a them international.
2016-04-13,2016-04-16,True,Morning box entire huge though field.
2011-03-22,2011-03-26,False,Yourself bank state Republican.
2018-05-15,2018-05-20,True,Never eat better together never.
2015-03-26,2015-03-28,False,Growth care at look.
2011-06-05,2011-06-09,False,Institution eat trip size opportunity.
2017-06-18,2017-06-21,True,Including then total.
2010-08-17,2010-08-22,True,Point activity piece woman whatever well him.
2010-12-31,2011-01-03,True,Water couple stuff evidence southern.
2011-01-15,2011-01-17,True,Mother human form camera.
2016-04-13,2016-04-14,False,List reality drive wide.
2016-11-19,2016-11-24,False,Perform cut anyone lose him.
2016-09-01,2016-09-02,False,Do his direction represent simple behind green.
2018-10-08,2018-10-09,True,Ask than yeah upon.
2012-03-17,2012-03-18,False,Production these per teacher style campaign several.
2018-06-29,2018-06-30,True,Reflect already campaign decision cup.
2011-02-06,2011-02-08,True,Middle natural give mean effect together.
2017-09-26,2017-09-30,True,Begin cell of key reach face.
2018-10-20,2018-10-25,False,Run them news enter eat.
2015-05-19,2015-05-23,True,Teach mother number start clear drop turn.
2010-07-13,2010-07-15,True,Quite rich management indeed.
2010-08-31,2010-09-05,False,Other life figure exist physical young.
2016-05-25,2016-05-30,True,End prepare issue resource soldier expect.
2010-04-02,2010-04-05,True,Method level various speak between spend what.
2014-05-28,2014-06-01,False,Past box us billion stuff.
2017-10-20,2017-10-24,False,Both present recent different environmental.
2015-03-19,2015-03-23,False,Others sometimes spring sense best central green.
2017-08-27,2017-08-30,True,South data with field positive might.
2015-04-15,2015-04-20,False,Management child over safe almost meet.
2018-05-02,2018-05-04,False,Room TV director.
2016-05-28,2016-05-30,False,Operation about instead discussion resource.
2017-12-11,2017-12-12,True,International million radio property however.
2013-01-02,2013-01-03,False,Direction thus agreement industry local organization fear.
2013-12-31,2014-01-03,True,Threat you as serve product.
2015-05-19,2015-05-21,True,Prevent seat avoid cover step enough summer.
2010-01-09,2010-01-14,False,Assume however memory air require military challenge identify.
2013-07-18,2013-07-21,True,Provide author would should.
2010-11-27,2010-11-28,True,Significant half fine start front dinner.
2016-03-05,2016-03-10,True,Cost remember reveal well girl front own.
2014-09-30,2014-10-03,True,She course sport avoid.
2016-02-04,2016-02-05,True,Dinner meeting everyone energy now.
2011-06-16,2011-06-20,True,Civil civil campaign nor.
2016-08-26,2016-08-28,True,Firm any money send.
2012-08-15,2012-08-16,True,Defense already professor baby forget.
2015-08-03,2015-08-04,False,Area Mrs market former.
2010-10-05,2010-10-08,False,Six government surface accept themselves culture.
2015-02-10,2015-02-14,False,People public government your similar mouth wide.
2010-05-18,2010-05-21,True,Less guess memory with first.
2012-04-06,2012-04-07,True,Really end agency once.
2015-04-23,2015-04-27,False,Up development head doctor.
2010-08-02,2010-08-06,True,Recently imagine grow you story garden.
2012-07-15,2012-07-19,True,Amount including six.
2014-12-26,2014-12-29,False,Community available doctor realize music young cultural.
2017-04-16,2017-04-17,True,Town grow culture.
2014-01-04,2014-01-09,True,Wait situation test herself hard whole else.
2014-03-03,2014-03-06,True,Close church record two.
2014-07-25,2014-07-26,False,Instead provide budget cost per even during.
2015-07-21,2015-07-25,False,Stand line rest Congress life more.
2011-06-03,2011-06-05,True,Try magazine population.
2011-12-27,2011-12-31,False,Factor radio discover pay tax call daughter.
2011-05-07,2011-05-10,False,Record fight wall range.
2014-11-06,2014-11-08,True,Air debate analysis develop.
2010-12-20,2010-12-22,False,Cut hotel campaign view along sing plan bring.
2011-04-18,2011-04-21,True,Seat sound student ten policy simply.
2015-06-05,2015-06-06,False,Phone green mouth sit teach.
2018-06-26,2018-07-01,False,Sort seem month reach message.
2017-01-27,2017-02-01,False,Picture research read it let conference direction.
2010-06-28,2010-06-30,True,Tough reduce see when audience finish bring.
2014-05-03,2014-05-06,True,Door summer performance certainly stage current on.
2010-01-15,2010-01-17,True,Number make growth.
2013-03-03,2013-03-06,False,Model while man manager.
2011-09-08,2011-09-12,False,Lay national challenge toward floor away.
2018-02-25,2018-03-01,False,Government front spring campaign.
2018-01-10,2018-01-15,False,Worry opportunity large age.
2016-05-15,2016-05-20,False,Administration wife husband visit next man stay.
2011-11-29,2011-12-04,False,Enough physical side operation.
2011-03-13,2011-03-16,True,Begin learn shake.
2010-11-10,2010-11-11,True,Since executive toward tough huge.
2016-11-30,2016-12-02,False,Miss affect outside can much husband.
2016-10-16,2016-10-17,True,Actually two that above rate.
2011-03-03,2011-03-08,True,Difficult stock usually type Mr order interest end.
2014-10-22,2014-10-24,True,Accept rise gas land drive responsibility begin.
2013-06-29,2013-06-30,True,Soldier admit fill day fall everyone something.
2012-02-09,2012-02-10,False,Usually away fish.
2016-05-12,2016-05-17,True,List let quite he yard Congress.
2013-05-05,2013-05-09,True,Wife want that life able close.
2015-07-10,2015-07-13,False,Method debate green teach space.
2014-07-05,2014-07-09,False,Sister daughter win worry put pay.
2016-10-04,2016-10-08,False,Wonder order state let at position.
2015-02-28,2015-03-02,False,Enter sing save political those group pattern.
2011-07-03,2011-07-04,False,Continue nation safe always kind food include.
2017-12-26,2017-12-29,False,Several huge key next government international fine.
2010-08-14,2010-08-16,True,Media notice recently.
2013-02-13,2013-02-17,False,Reason to data serve out choice.
2018-10-19,2018-10-24,True,Western anything probably report newspaper those own.
2016-04-21,2016-04-22,False,No onto outside box nor cold nice.
2012-12-04,2012-12-08,False,Suffer television popular dinner class view.
2011-10-25,2011-10-28,False,Court own college well.
2015-05-05,2015-05-09,True,Include experience none more.
2018-03-19,2018-03-24,True,Table spend exactly tell official rich.
2010-10-29,2010-11-01,False,Word throughout option success glass staff itself.
2011-04-18,2011-04-20,True,Senior until account expert right government talk system.
2016-05-23,2016-05-27,True,Vote past ask public.
2013-01-10,2013-01-12,True,Economic read those threat determine.
2018-07-07,2018-07-10,False,Study put worry parent similar through long.
2011-06-10,2011-06-14,True,White identify street size budget.
2014-06-10,2014-06-13,True,Such lose finish magazine describe police.
2012-02-04,2012-02-05,False,Condition involve star successful single.
2018-06-21,2018-06-24,True,Ready challenge truth alone simple.
2013-05-28,2013-05-31,True,Picture feeling them environment action.
2010-10-25,2010-10-28,True,Career before my necessary reach.
2014-12-06,2014-12-07,True,Sea care no management.
2012-01-08,2012-01-13,True,Special happy painting myself Republican certainly.
2013-07-08,2013-07-13,True,Number above decade author.
2012-02-11,2012-02-16,False,Near system decision similar simple what.
2015-10-21,2015-10-23,False,Letter professional could attention.
2014-05-19,2014-05-20,False,Increase style experience.
2015-12-19,2015-12-20,False,Represent study contain wind kind game.
2016-04-11,2016-04-16,True,Stand day stand simple step.
2013-06-02,2013-06-07,True,Rest deep get call amount.
2016-11-08,2016-11-09,False,Public enough off year beyond idea.
2013-06-23,2013-06-28,True,Boy possible development.
2018-10-15,2018-10-20,False,His matter no simple simply decade find.
2010-03-12,2010-03-15,True,Apply call ball able thus.
2011-12-09,2011-12-14,True,Consider weight writer girl church forward garden.
2017-09-12,2017-09-13,True,Thing you shake newspaper approach rich.
2012-01-24,2012-01-26,True,Others employee machine beyond sign.
2015-05-11,2015-05-13,False,Skill tell collection feel speak foot.
2010-08-26,2010-08-30,True,Pick simply century section hand to wall general.
2016-06-04,2016-06-09,True,Notice paper fly pay eye manager goal since.
2011-07-24,2011-07-28,False,Get card let there.
2018-04-30,2018-05-05,True,Hour bar serve civil sport watch.
2017-08-17,2017-08-18,False,Identify turn door many probably compare second.
2016-10-07,2016-10-11,False,Eight example compare federal particular manager support.
2013-10-30,2013-11-04,False,Tv director cause perform.
2016-07-20,2016-07-24,False,Write finally ground single media talk gun.
2015-10-26,2015-10-30,False,Entire skill history answer simply.
2010-08-05,2010-08-07,False,Because air improve president.
2010-05-23,2010-05-28,False,Same include large chance trouble.
2015-05-31,2015-06-03,False,Case his turn road foot example fund.
2015-05-20,2015-05-23,False,Trip happen another church stay.
2017-08-30,2017-09-03,True,Never example continue.
2013-04-18,2013-04-19,False,Away study may Mr affect edge final.
2012-02-07,2012-02-10,False,Focus party cold interview force.
2016-08-16,2016-08-21,True,Section close shoulder soldier necessary.
2013-09-10,2013-09-14,True,Ready degree short three as go white.
2010-04-09,2010-04-11,True,Soldier place up term several event someone.
2015-05-23,2015-05-27,False,Address second get.
2012-06-06,2012-06-07,True,Team suddenly reduce foreign painting question.
2014-10-19,2014-10-21,False,Tell short outside reach open security.
2014-08-19,2014-08-22,False,Try rather indeed identify final our southern.
2017-06-20,2017-06-25,False,When body offer thus guess sort.
2013-11-17,2013-11-22,True,Local threat eat five.
2016-01-04,2016-01-05,True,Total eat edge food economic herself now.
2011-10-19,2011-10-22,True,Surface sit myself guess above however manager imagine.
2016-04-07,2016-04-12,True,Ok material along yard general.
2018-10-09,2018-10-14,True,Them card cover agent without.
2015-05-18,2015-05-23,True,Subject record detail.
2013-09-06,2013-09-09,True,Agent long like others three painting become public.
2017-03-20,2017-03-24,False,Plan use who.
2012-09-22,2012-09-25,False,Produce participant feeling name easy simple teacher.
2010-01-29,2010-01-30,False,Land anything include.
2014-01-26,2014-01-28,False,Parent realize clear soldier.
2010-10-24,2010-10-29,False,Serve subject customer evidence door.
2010-06-14,2010-06-16,False,Rest when generation.
2010-04-13,2010-04-15,True,Talk happy party son.
2011-11-11,2011-11-16,False,Job school impact my television range bed each.
2011-01-30,2011-02-01,True,Heavy late build future leave campaign quickly.
2010-08-20,2010-08-24,True,Miss ask story car possible appear again culture.
2010-10-07,2010-10-10,True,Analysis challenge big character color safe too.
2016-07-25,2016-07-28,True,Fine world early pretty.
2014-10-16,2014-10-19,True,Police different budget really.
2018-09-12,2018-09-17,True,Owner control gas low.
2015-02-27,2015-03-03,False,Star development agree lawyer.
2013-08-09,2013-08-13,True,Be cover music what allow responsibility nor.
2017-11-06,2017-11-08,True,Learn poor myself.
2012-12-18,2012-12-23,False,Spend key yes study.
2015-05-01,2015-05-04,True,Wife beautiful we.
2017-11-09,2017-11-13,False,May best others know.
2018-10-02,2018-10-05,False,Oil arm find.
2018-05-27,2018-05-31,False,Coach effort heavy hospital exactly.
2017-09-28,2017-10-03,False,Treat care travel decide.
2017-01-07,2017-01-08,False,Drive but with report.
2013-12-26,2013-12-29,False,Fact need always read picture cell.
2013-05-13,2013-05-14,False,Live power health sometimes.
2010-08-26,2010-08-28,False,Up everybody speech put.
2018-07-09,2018-07-12,True,Difficult challenge market.
2013-12-05,2013-12-07,True,Author single street buy.
2012-04-16,2012-04-18,True,Herself box analysis race.
2015-11-25,2015-11-30,False,Kitchen series young both daughter respond.
2013-07-23,2013-07-28,True,Although activity keep back ahead us partner.
2011-11-14,2011-11-17,False,Front garden candidate task.
2014-01-20,2014-01-21,True,All hair involve boy before personal build rest.
